tweet,rotulo
Fiz simulado enem hoje e citei o  @cirogomes  e o projeto de renda mínima. Tomara que eu tenha argumentando da melhor forma... Ansioso pra saber a nota e o vai dizer a corretora kkkks,0
"Os eleitores de Ciro Gomes..  ..que se julgam muito inteligentes não estão compreendendo a gravidade da existência de um segundo turno. Esse não é um processo eleitoral como os outros, estamos enfrentando a reação fascista.  A vitória de Lula não está dada.",2
"Pessoal q apoia Moro dizendo q iria votar nulo no 2° turno e q n vai mais. Já pensaram em votar em Simone Tebet no 1° turno pra n precisar votar em Bolsonaro no 2°? Vem de Simone Tebet, ficha limpa, q a gente derrota os dois! Simone nunca perseguiu Moro como Bolsonaro e Lula!",0
Especialmente para você  @simonetebetbr  !!!,0
"Pessoal,  só para avisar que a Simone Tebet  não quer que esse vídeo seja retuitado !!  #MichelPelasMulheres",0
"Vamos conscientizar que este vídeo, não pode ser retuitado porque a Dona Simone Tebet não quer #MichellePelasMulheres",0
"Orgulho da minha vida é eu falar “Meu voto o Bolsonaro não ganha” e meus pais falarem “o meu também não, nunca ganhou e nem vai ganhar”",0
"Meu voto para o Senado no Paraná: É PAULO MARTINS, Senador 222! Jamais votarei Álvaro Dias,  que detesta Bolsonaro, e no Senado NADA FEZ diante das arbitrariedades do STF!  Jamais votarei Moro, que traiu Bolsonaro, traiu o Brasil e os brasileiros.  Bolsonaro 22!",0
"O Brasil da liberdade é com Bolsonaro! Juntos, vamos vencer as forças do atraso. Um abraço!   Paulo Martins, senador 222 Bolsonaro, presidente, 22",0
"E RECADINHO PRA O EX PRESDIÁRIO LULA E A CORJA DELE. O BRASIL, NA SUAA MAIORIA É DE FAMILIAS POBRES MAIS HONESTAS. @jairbolsonaro",1
Mandou o recado..,0
Mandou o recado..,0
"E RECADINHO PRA O EX PRESDIÁRIO LULA E A CORJA DELE. O BRASIL, NA SUAA MAIORIA É DE FAMILIAS POBRES MAIS HONESTAS. @jairbolsonaro",1
"Periferia nada só pensa neles mesmo!!! Esse é o pt, o lula gasta e ganha milhões e da esmola pra quem não tem!",1
"ok, sou pau mandado e ela fez eu me declarar pra ela imitando o lula e o bolsonaro, big night",1
cirogomes: Todo mundo ON na http://cirotv.com.br ? ,0
"Se a Simone Tebet ultrapassar Ciro Gomes nas pesquisas, ele recua.",2
"Plano para tirar o nome do SPC do Lula deveria se chamar - ""Plano Limpa Nome Ciro Gomes""  Justo!",2
"Eita como é caipira! Lana Del Rey via Instagram com seu pai, Rob Grant.",0
"Se a Simone Tebet ultrapassar Ciro Gomes nas pesquisas, ele recua.",2
Mãe da Simone Tebet,0
Simone Tebet é muito preparada. Dará uma ótima ministra da agricultura do governo Lula,1
Faz o L vote 13 manda Bolsonaro para Bangu 8. #LulaEoPT13deFioApavio,0
"Parafraseando Ulisses Guimarães: Eu tenho ódio e nojo desses pastores empresários, de Jair Bolsonaro e de quem o apoia.",0
"Segundo o IPEC, ex Ibope q mudou d nome devido aos vexames  nas pesquisas em 2018, o Ex Presidiário vence nosso Capitão em SP, MG e no RS!! Te ilude lacrolândia, paulistas, mineiros e gaúchos jamais votariam no ladrão após a votação estrondosa q deram em 2018 a Bolsonaro.",0
"A galera que está no Rock in Rio tem opinião e vota Lula! Você que é do povo do Rio de Janeiro tem que votar  @LulaOficial  presidente,  @MarceloFreixo  governador,  @lindberghfarias , deputado federal  @rmonteir0  e pra senador  @AndreCeciliano",1
Eleições 2022: Lula critica machismo e acena a mães e trabalhadoras após derrapar com mulheres https://www1.folha.uol.com.br/poder/2022/09/lula-critica-machismo-e-acena-a-maes-e-trabalhadoras-apos-derrapar-com-mulheres.shtml?utm_source=twitter&utm_medium=social&utm_campaign=twfolha…,1
"Se o Lula ganhar você vera isso durante os quatro anos, aff",1
Michael Jackson seria Lula ou Bolsonaro?,1
"Lula quadruplicou orçamento da educação, quem tá com Lula comenta aí ESTOU COM LULA",1
“Mulheres e Jovens vão salvar o Brasil “. Ciro Gomes   #CiroTV,2
"Peguem os programas completos da propaganda eleitoral e impulsionem no YouTube  @JoaoTrabalhista ,  @cirogomes ,  @gisellebezerra ,  @PDT_Nacional ,  @CiroNoFlow  ,  @agoraeciroofc",0
Votar no ciro é equivalente a votar na mari baianinha no paredão mari x prior x manu gavassi,2
"Como eu sempre pergunto: fora do twitter, o Ciro Gomes existe ?!?!",2
"Votar na linha auxiliar do fascismo que aglomera em torno de Lula, Alckimin, Geddel, Eunicio, Renan etc...  jamais. Eu voto  @cirogomes  #EuVotoEmProjeto #CiroCresce.",1
Não esqueçam de divulgar.Antes que a  @simonetebetbr   entre na justiça.,0
Bolsonaro podia pegar essa ideia da   Simone tebet e dá 5k pra cada aluno eu apoio,0
Quem quer liberar a droga no Brasil e defende o Tráfico faz isso: *Governo Bolsonaro corta 96% dos investimentos da PF em combate ao tráfico*  Agora é que as milícias vão adorar.  *Leia no Blog Gama Livre* https://cutt.ly/4CfNkzA,0
2026  Michele Bolsonaro Presidente do Brasil  @jairbolsonaro   @Zambelli2210   @CarlosBolsonaro,0
Hoje temos orgulho de ser brasileiro!,0
" Não desista,  Deus te abençoe,  estamos orando por você  @jairbolsonaro  .",0
No governo Lula a lanchonete mandaria um lanche de presente pelo transtorno! Neste governo a gente nem pede o estorno com medo de descontarem do trabalhador,1
"Nunca se viu nesse país, tanta paixão pela candidatura de alguém.  @LulaOficial  presidente está presente onde estão talentos brasileiros! Maria Betânia presente! #LulaOBrasilPedeVoteLula",0
BETHÂNIA TERMINA MÚSICA E FAZ O L DE LULA,1
"E a propaganda do biroliro que disse que com 600 reais o carrinho sai mais cheio que na época de Lula e que ainda ""dá pra comprar sorvete e picanha"" ",1
#CiroGomes imaginar explicar isso numa favela?,0
Racionais Ao Vivo no #RockInRio    : @jefdelgado,0
E hora de elegermos um projeto nacional de desenvolvimento! borá turma boa! A maior virada da história! Vamos  @cirogomes,0
PRA TODO MUNDO EU DIGO CIRO!,0
Simone Tebet pela manhã em Belém do Pará e a tarde em São Paulo. Rumo ao Planalto. #SimonePresidente15,0
"Chore, esquerdopata  @simonetebetbr  e cia.!!!",0
"Aqui quem manda sou eu, O recalque da  @simonetebetbr  não chega. #MichelleBolsonaro  #BolsonaroReeleitoEm2022  #Aguanosertao  #2022 #brasil",0
Xandindo PCC INIMIGO do Brasil   #BolsonaroReeleito2022  #TarcisioGovernadorSP2022  DEUS ABENÇOE E PROTEJA NOSSO PRESIDENTE BOLSONARO ,0
festinha em família aq em casa já chegou na parte do lula e bolsonaro e ja ta ficando bom ,1
"Amigos/amigas/amigues eleitores de Ciro e Tebet. Façamos um acordo: Se faltando uma semana pra eleição eles tiverem chance de derrotar Bolsonaro e ir pro segundo turno, viro o meu voto pra ajudar e vamos debater projeto na fase 2. Se não, vocês nos ajudam a acabar logo com isso.",0
festinha em família aq em casa já chegou na parte do lula e bolsonaro e ja ta ficando bom ,1
"Desculpa tio  @LulaOficial !!! Fui #ForaLula, fui #ForaDilma e descobri que eu só estava mesmo era #ForaDaCasinha  #LulaNo1ºTurno #LulaPresidente13",0
"""Por que vc vai votar no Lula sendo que ele roubou tanto?""  Bom, aí está minha resposta:",1
Vitória de Lula no primeiro turno!,1
"Votar em projetos e ideias. O Brasil precisa e merece mais do que escolher o ""menos pior"". Por isso eu voto em Ciro Gomes.  #CiroPresidente12  #CiroCresce   PND",2
Ciro tem propostas concretas para o nosso Brasil sair das garras desta oligarquia atrasada e elitista que nós domina a séculos.,2
Tem que cortar essa parte e jogar aqui ADM  @cirogomes HABLA CIRO #CiroTV se ciro,2
SIMONE TEBET PORQUE VOCÊ PEDIU TIRAR MICHELLE DO AR??? PORQUE VOCÊ É TUA AMIGUINHA RENAN OMAR RANDOLF CARLOS GABAS DEVOLVEM DINHEIRO ROUBADO DA VACINA COVID LULA E VOCÊS TOMARA PRECISE DRa NISE DRa MAYRA,0
"ESSA ELA NÃO ESPERAVA! Confira o que a Doutora Nise Yamaguchi RESOLVEU M... https://youtu.be/bEkUCcOTDpc via  @YouTube  @simonetebetbr  está muito complicado, você só defender suas mulheres, #vergonhaalheia",0
igualzinha a simone tebet,0
Isso aqui é muito bom.,0
Proximidade do 7 de setembro + Pesquisas e Bolsonaro escolhe navegar por mar revolto,0
Gabriela Prioli diz que Bolsonaro será varrido de volta para o lugar de onde nunca deveria ter saído,0
acabei de mandar emoji de vômito pra uma foto sobre o bolsonaro no grupo da família esperando as consequências,0
péssima notícia para lula https://youtu.be/XM69Z_60-74 via  @YouTube,1
"Lula ganha em MG , mas o R Zema ganha do Kallil, temos que consertar isso, Kallil tá com Lula.",1
"Absurdo Lula diz que foi absolvido, mas segue com problemas na Justiça...",1
Quiserem de fato o melhor é  @cirogomes  12. No mais é populismo.,0
"'O Brasil parou de crescer e são 11 anos', dispara Ciro Gomes contra Bolsonaro e o PT https://jc.ne10.uol.com.br/politica/2022/09/15074103-o-brasil-parou-de-crescer-e-sao-11-anos-dispara-ciro-gomes-contra-bolsonaro-e-o-pt.html…",2
"Eai tio, é ⁦ @cirogomes ⁩ !",0
"51 Imóveis! Ciro Gomes AVISOU ""Bolsonaro corrompeu os filhos e as esposa... https://youtu.be/pQNDnz0a7ak via  @YouTube",2
"Ciro Gomes, Simone Tebet e Soraya Thronicke estão no segundo pelotão das pesquisas de intenção de voto, atrás de Lula e Bolsonaro.",2
Aliados de Bolsonaro 'driblam' TSE e postam vídeo de Michelle vetado na TV https://zpr.io/XpsZRmaxPSuz,0
Dra Nise Yamaguchi solta o verbo e desmente Simone Tebet; VEJA VÍDEO,0
É Jair ou já era! Vambora #B22,0
"Enquanto o desemprego aumenta a passos largos na Europa, EUA, e, principalmente nos países da América Latina (todos apoiados pelo Lula), no Brasil o desemprego está em queda acelerada. Hoje estamos em 9,1%, mais 4 anos de Bolsonaro/ Guedes chegaremos abaixo de 5%, certamente.",1
Aí se fosse o Bolsonaro falando uma merda dessa?,0
Ele conhece ele entende ele sabe o que fala esse homem vai ficar na istoria do Brasil siga a opinião dele eu já faço isso é Lula 2022,1
"Enquanto o desemprego aumenta a passos largos na Europa, EUA, e, principalmente nos países da América Latina (todos apoiados pelo Lula), no Brasil o desemprego está em queda acelerada. Hoje estamos em 9,1%, mais 4 anos de Bolsonaro/ Guedes chegaremos abaixo de 5%, certamente.",1
"ué se o Lula tá com o Danilo, como a Marília pode colocar o nome do Lula como se tivesse com ela?",1
"Irei votar 12 no 1ºT e 12 no 2ºT,  @cirogomes  esteja ou não na disputa. Mas ele há de está. Eu tenho muita fé. Votar em Ciro é pra quem acredita!  #CiroPresidente12  #CiroCresce  #CiroGomes #PrefiroCiro  #TurmaBoa",0
O pai  Da transposição do Rio São Francisco  Tudo começou com a luta e o projeto  De Ciro Gomes,2
"""interessante"" a forma como o PT tá tentando tirar votos do ciro gomes justificando como risco à democracia, quando na verdade só mostra a certeza deles de que o PT sairá derrotado no 2o turno, para qualquer um.  risco à democracia = risco à hegemonia",2
"Viva nossa Primeira Dama  @simonetebetbr  , você não irá nos calar ",0
TSE acatou pedido da Simone Tebet pra tirar este vídeo do ar.  Simone não quer que as mulheres saibam o que o governo está fazendo. @simonetebetbr,0
Simone Tebet é pior que Bolsonaro,0
"MICHELLE BOLSONARO DETONA SIMONE TEBET ""Diz que mulher tem que votar em mulher, mas entra na Justiça para calar outra mulher?”. ",0
"""você vai votar em quem?""  ""no bolsonaro""  ""graças a deus"" ",0
A hipocrisia do Lulopetismo chega ao nível do ridículo. Querem tirar o Bolsonaro ou ganhar sem fazer força? Qual seria a maior desmoralização para o Bozofascismo? Ficar em 2o e perder no primeiro turno ou ficar em 3o e nem ir para o segundo turno. Meu voto é  #CiroPresidente12,0
Esse sujeito está delirando deve está muito doente ou ficando louco  comparar a queda do peço da gasolina com a subida de Lula eu tô digo que os dois estão caindo.,1
"Lula em Belém do Pará, 2022. É de arrepiar!",1
"Onde Lula vai, ele atrai multidões  Em outubro, é 13.  #MoroNaCadeia #GloboNews #CNNBrasil #JN #jornalnacional #G1",1
"Tem quem se iluda que com as eleições mudaremos a vida, com certeza a vida de quem necessita mais irá melhorar com a eleição do Lula.  Mas o que precisa ser mudado de fato é o nosso sistema político e pra isso é necessária uma profunda mudança na consciência da sociedade.",1
pq o brasileiro nao entra num acordo pra nao voltar nem no bolsonaro e nem no lula plmdsss,1
Bolsonaro e Lula que se cuidem...  Padre Kelmon como candidato substituto de Roberto Jefferson à Presidência.,1
Esse é o pessoal que diz combater fake news?  O sujeito está atribuindo a queda do preço da gasolina ao ex-presidiário... ,0
falaram que parece a tidinha com o ciro gomes chega,2
Ciro Gomes 12 ,2
"Veja nosso quarto programa eleitoral completo, que foi exibido há pouco na http://cirotv.com.br. Você vai ficar sabendo tudo sobre a Lei Antiganância e a renegociação das dívidas que vai limpar o nome de todo mundo que está no SPC e no Serasa. #CiroPresidente12",0
"Michelle Bolsonaro expõe “hipocrisia” de Simone Tebet; VEJA https://terrabrasilnoticias.com/2022/09/lapada-michelle-bolsonaro-expoe-hipocrisia-de-simone-tebet-veja/…  Segundo a primeira-dama, o pedido de Tebet é baseado numa contradição: “Diz que mulher tem que votar em mulher, mas entra na Justiça para calar outra mulher?”, questionou.",0
Toma vergonha  @simonetebetbr  !,0
"Como evangélico posso dizer, a candidata  @simonetebetbr  mexeu com uma mulher que ora (a Deus e ao Senhor Jesus Cristo). Simone, ninguém vence uma pessoa que ora!",0
Mas .... Muito estranho .... a gente vai ver a verdade das pesquisas dia 3 de outubro.  BOLSONARO REELEITO NO PRIMEIRO TURNO,0
A maior diferença é que ao comícios do Presidente Bolsonaro o povo vai de graça! #BolsonaroReeleitoEm2022 ,0
 ASSIM ESTÁ O MAPA DO BRASIL ATUALMENTE SEGUNDO PESQUISAS REALIZADAS NOS ESTADOS SEGUNDO O INSTITUTO IPEC.,0
"É  @LulaOficial  , é no primeiro turno!",0
Sou fã das voltas que o mundo dá. GRANDE DIA,0
"Lambram o que o Moro fez após a decisão do STF e Fachin ao soltarem o Lula? Pois é, tá aí o resultado.",1
A Justiça eleitoral enlouqueceu? Via @taoquei1,0
EX-JUIZ QUE CONDENOU LULA SEM PROVAS ..........,1
"URGENTE!! Busca e apreensão na casa de SÉRGIO MORO!!  A Justiça Eleitoral autorizou o pedido porque Moro tem materiais de campanha IRREGULARES, e há suspeitas de fraude eleitoral.  Hoje ele acordou com a POLÍCIA batendo na porta dele às 6 da manhã!!  TIC-TAC JUIZ-LADRÃO!!",0
"Depois de sua temporada em Paris em 2018, Ciro Gomes foi submetido a uma cirurgia na próstata. É urgente que o candidato apresente exames que comprovem que está em plenas condições de saúde física para governar o Brasil. Queremos saber",2
Aqui é 12  @cirogomes,0
"""Precisa de um Presidente. Precisa de uma mulher para arrumar a casa...""  @simonetebetbr    ela está fazendo campanha para quem?",0
VERGONHOSAS SIMONE TEBET  @MDB_Nacional  E  @maragabrilli  @PSDBoficial  !!!,0
"""Não é porque o governador desviou recurso federal que ele deve ser investigado."" Simone Tebet   Presidência, deve ser lugar de exemplo!",0
"Ninguém está acima da lei. Nada contra a primeira-dama fazer campanha, mas tem que ser dentro da lei. Aliás, presidência deve ser lugar de exemplo.",0
"Só tolos acham que Bolsonaro não é igual a Lula São iguais, idênticos, cada um liderando uma seita de fanáticos",1
E a culpa é de Moro que fica fazendo acenos para Jair Moro nunca será perdoado pela família Bolsonaro e os bolsonarista fanáticos twitter.com/institutopapo1…,0
"Desde de 2018 eu escuto: - Lula ""roubou"", tem um sítio e um triplex!!  Mas a minha vez chegou, agora é: - Bolsonaro ""honesto"", com 51 imóveis comprados com dinheiro vivo!!  O mundo não gira, ele .... (complete a frase). Kkkkk",1
"Nove duple: Os Barões da Rachadinha Eu achave que elxs nãe gostavem de ume rachadinhe, especialmente o randolfx  #BolsonaroReeleitoEm2022  #bolsonaro #BolsonaroTemRazao",0
Bichão todo mundo sabe que o Bolsonaro não vale nada. Mas quem quer prender Moro e Deltan é a facção criminosa chamada PT. Votarei em QUALQUER UM contra o Lula.,0
"o programa eleitoral do lula tá uma b0sta nem bolsonarista infiltrado faria pior ao invés reproduzirem a exaustão as falas de bolsoasno contra as vacinas,debochando da fome ''fuzil no lugar de feijão'' fazem um programa generico falando nada com nada,2º turno pode ser tarde",0
puta merda agora eu vi o vídeo do Ciro Gomes falando praticamente que favela só tem burro,2
"Hoje o presidente da República disse que, quando ele sofreu um atentado a faca na campanha eleitoral de 2018, "" esse pessoal da esquerda ficou calado"". Peço que acompanhem o fio.",0
"""pessoal de esquerda"" ai tem o ciro gomes na thread",2
"“Os dois são lobos, um em pele de cordeiro” #NemLulaNemBolsonaro",0
"Andaaaa  @cirogomes , agiliza essa ida ao  @ovenuspodcast  pelo amooordi  @gisellebezerra  @AnaPaulaMatosBA  @AmandaPDT12",0
Vai serno 1° turno! Bolsonaro hoje em Novo Hamburgo/RS.,0
Olá  @LulaOficial  @cirogomes  @simonetebetbr  hahahahaha #BolsonaroReeleitoEm2022  #BoicoteAoPSD55,0
"MICHELLE BOLSONARO DETONA SIMONE TEBET ""Diz que mulher tem que votar em mulher, mas entra na Justiça para calar outra mulher?”.",0
Não poderíamos esperar coerência nas palavras da Simone Tebet.,0
Michelle Bolsonaro retruca e dá lição de moral para Simone Tebet sobre l... https://youtu.be/5fP-0ZGbAS8 via  @YouTube,0
minha mãe é a 5º eleitora da simone tebet,0
MANO CARA NOJENTO EU ME PERGUNTO POR QUE TEM GENTE QUE APOIA ESSE CARA.   NÃO POSSÍVEL BOLSONARO CORRUPTO ODEIA MULHERES,0
" “Você preferia sacar da bolsa a Lei Maria da Penha ou uma pistola?”, pergunta Jair Bolsonaro (PL) a mulheres durante evento de campanha no Rio Grande do Sul.",0
Um governo que facilita a vida das pessoas.  @jairbolsonaro  ,0
E desde que o bolsonaro ganhou esses 4 anos eu so me ferrei nesse sentido,0
"Eu só queria saber dos eleitores de Ciro, se no 2turno eles vão de Lula, ou vão pra Paris?  pq eu votaria em qualquer 1 contra o Bozonazi",1
Amanhã  vou adesivar meu carro com a foto e o número  do meu candidato a governador  e Presidente. Lula e Haddad Hoje virei alguns votos. Um dia de cada vez. Boa noite .,1
- Mãe vou votar no Lula - Vai votar Nulo? - NO LULA!,1
Socialite pede a agricultores demissão de eleitores de Lula: 'Sem dó' - Politica - Estado de Minas,1
LULA PRESIDENTE JÁ,1
O problema mesmo não é nem garantir #LulaNo1ºTurno ... O lance é imaginar alguém votar no  @cirogomes  e depois ter dúvidas num segundo turno.....  #ForaBolsonaro,0
Ciro Gomes critica número de trabalhadores informais no país: ’50 milhões estão vivendo de bico’,2
Uma coisa ficou evidente na chapa de CIRO. Não tem conluio com balaio de gatos e partidos  que só querem uma teta pra mamar. Não tem vice com histórico nebulozo nem fascista de plantão. É uma certeza de que o governo CIRO GOMES será de salvação nacional sem corrupção e fascismo,2
ESTEPE invejosa! Sua luta pelas mulheres nem começou e já acabou dona  @simonetebetbr  a sua inveja foi maior,0
SIMONE TEBET É TÃO NADA...,0
O lugar da mulher é onde a Simone Tebet quiser?!,0
"Aprenda, vc não pode dizer a verdade para pessoas como  @simonetebetbr Repita apenas as narrativas que eles tentam te empurrar goela abaixo.",0
minha mãe é a 5º eleitora da simone tebet,0
"Gabriela Prioli rebate Bolsonaro: 'Sinto medo mas não me calo' - Politica - Estado de Minas https://em.com.br/app/noticia/politica/2022/09/02/interna_politica,1390843/gabriela-prioli-rebate-bolsonaro-sinto-medo-mas-nao-me-calo.shtml…   Quem ataca também tem que ter peito para aguentar verdades.  Simples assim.",0
É uma vergonha essa mídia corporativista. Fico só pensando nos interesses que há por trás para dar essa proteção a Bolsonaro.,0
"Tapioca de R$ 7 ficou semanas nas manchetes e derrubou ministro. Pedalinho, meses. Triplex sem certidão nos cartórios, anos nas manchetes e cadeia até o STF anular tudo. 107 (cento e sete) imóveis do Clã Bolsonaro, DINHEIRO VIVO e já sumindo do noticiário",0
E no tik tok que uma mulher fez isso pra ganhar dinheiro do gado do Bolsonaro e do Lula. Vai ser burro assim na pqp. Por isso eles roubam!,0
KKKKKKKKKKK  OLHA O LULA LADRÃO  !!!,1
"Moro é  réu,  enquanto LULA lidera pesquisas p PRESIDENTE...KKKKK",1
 URGENTE!!! DESMORONOU!!!  Justiça Eleitoral acaba de determinar busca e apreensão de materiais de campanha irregulares na casa de Sergio Moro!!! Bandido bom é bandido Quack!!!  Essa corja que se alia com Bolsonaro é um mais sujo que o outro!!! Deltan e Moro sujos na Justiça!!!,0
Brasil será país que eu presidente #Eleicoes2022 ? Lula 44%  PT Partidos trabalho oportunidades Governador Haddad tem 27%  Não entendi a senado Fora Bolsonaros ?  linha de casa agora notícias Tarcísio 17% França 14%,1
"O grande Mario Heringer, homem de carreira, nome histórico p trabalhismo mineiro parecendo papagaio de pirata no jornal nacional dá o tom de quem comanda o PDT MG. Eu ficaria até orgulhoso, se não fosse ridícula a subordinação ao sem coligação e aceitação Ciro Gomes. Triste fim.",2
ciro gomes melhores momentos #03,2
"O Futuro presidente do Brasil é inteligente acima da média AND tem senso de humor! @cirogomes  você não é perfeito, mas é o melhor! #CiroPresidente12 #CiroCresce #Ciro12",0
"Alguém avisa ela que ela está passando vergonha? @marjoriejori , não deixe mais difícil a situação do PT por que sabemos dos ensinamentos públicos do governo Petista. A pior da História. Vamos eleger o  @cirogomes   por que ele tem projetos, é inteligente, não é mentira, não roubou.",0
"Chora mais  @simonetebetbr  , a propaganda é de graça !",0
Olha ai  @simonetebetbr,0
 EIIIII @simonetebetbr olha que encrenca você arrumou!!!!,0
O próprio Renan Calheiros que é no mesmo partido da  @simonetebetbr  e está recomendando votar no Lula. Sabe por quê? Porquê é voto útil para elegemos o Lula no 1° turno.,1
"De acordo com o DataFolha, @Lulaoficial lidera em todos os recortes, inclusive nos maiores colégios eleitorais como SP (40x35),MG (47x30), RJ (42x36)e BA (61x20). Lula também ja virou em estados como o RS (42x34).Cada dia é mais útil o voto útil para eliminar o inútil.",1
Eu Conheço  Bem. Todos os Que Hoje  Enche o  Peito e Grita Alto .....  FECHADOS COM BOLSONARO  Em 89   Enchia o Peito  e Gritava Alto :  LULA  LA    ...,1
NESTE PROGRAM SÓ ENTRA A FAMÍLIA BOLSONARO,0
"Alô  @YouTubeBrasil  legal essa Fake news paga pelo Bolsonaro hein, o que vc acha disso  @TSEjusbr",0
A do Lula na época a Marisa tinha vendido Avon,1
Discordo 100% do aborto.  Mas infelizmente lamento que sua mãe não o fez Lula. https://instagram.com/p/CiEUG-hMI12kSRrkktwzP43UYCC5PJpjYTrgB80/?igshid=YTgzYjQ4ZTY=…,1
Eu Conheço  Bem. Todos os Que Hoje  Enche o  Peito e Grita Alto .....  FECHADOS COM BOLSONARO  Em 89   Enchia o Peito  e Gritava Alto :  LULA  LA    ...,1
Namore alguém que te olhe como o vira-lata caramelo olha pro  @cirogomes,0
Neste época  @cirogomes  questionava a segurança do voto e apoiava o aperfeiçoamento O que Mudou?,0
"Eu sou contra Sonda Supermercado, heteros, carros europeus e Ciro Gomes",2
"Votando na Simone Tebet para presidente, você ainda tem Mara Gabrilli como vice! Dupla melhor não há  #SimonePresidente15  #MaraVice",0
"""Dra Nise Yamaguchi solta o verbo e desmente Simone Tebet; VEJA VÍDEO""",0
"Chora mais  @simonetebetbr  , a propaganda é de graça !",0
*Mais um video da Michelle Bolsonaro deixando Simone Tebet e a Janja desesperadas* #Brasil,0
Vou ligar pro Bolsonaro pra pedir um Rock in são paulo krl,0
"Podres Poderes: Moro, Lula, Bolsonaro e a Justiça seletiva do Brasil",1
"Quem fica de ""nem Lula nem Bozo, vamos encontrar outra solução"" deve tá num Brasil que não é o meu. Deixem a fanfic de lado porque NESSA ELEIÇÃO só é possível acontecer um desses dois resultados, basta escolher entre uma fruta amarga e uma fruta podre envenenada",1
Faz o L Brasil  Vamos juntos meu presidente  @LulaOficial ! Unidos por um Brasil melhor.,0
"Podres Poderes: Moro, Lula, Bolsonaro e a Justiça seletiva do Brasil",1
Meus votos até agora:  Dep. Federal: Heloísa Helena 1818  Dep. Estadual: PDT 12 - legenda Senador: Cabo Daciolo 120 - PDT Governador: Cyro Garcia 16 - PSTU Presidente: Ciro Gomes 12 - PDT,2
Ciro fala pra militante do mula livre,2
Ciro Gomes desvendando a mentira de Lolla ladrão,2
Essas lives para lançamento dos programas eleitorais estão muito boas!  Parabéns Ciro Gomes e equipe por mais essa inovação  #CiroTV,2
O vídeo temido por  @simonetebetbr  a mulher que diz defender mulher. INVEJA MATA! ,0
*Mais um video da Michelle Bolsonaro deixando Simone Tebet e a Janja desesperadas* #Brasil,0
Oi  @simonetebetbr !                                                       Esse era só isso o tweet. #BolsonaroReeleito2022,0
BOLSONARO ETERNIZA MAIS UMA CENA EPICA NA GLOBO fulminante cast #shorts https://youtube.com/shorts/T1ptPQJqa8k?feature=share… via  @YouTube,0
Luisa mel tá se doendo pq a juliette é Lula e ela é Bolsonaro,1
Esse Uber fez mais pela pela fome q todo o governo Bolsonaro,0
"Isso é um sinal, se o Lula ganhar ela vai lançar pelo menos uma música",1
nem parece que já fazem 13 anos que a rihanna fez essa performance no rock in rio,0
"Olinda, Pernambuco é Lula  Vamos seguir em frente com  @LulaOficial  presidente! #LulaPresidente13",1
Luisa mel tá se doendo pq a juliette é Lula e ela é Bolsonaro,1
Minha chapa: Presidente: Ciro - 12  @cirogomes   Senadora: Tereza  - 130 Governadora: Marília Arraes - 77  @MariliaArraes   Dep.Federal: Wolney Queiroz - 1234  @WolneyQueirozM Dep. Estadual: André Carvalho - 12456  @andrecarvalhoTT,2
Precisamos de um debate entre os vices @AnaPaulaMatosBA  @gisellebezerra  @cirogomes,0
"Eu só queria um debate de vices, @AnaPaulaMatosBA extremamente preparada debatendo com o Alckmin representando o PT  #CiroCresce #CiroPresidente12 #Ciro12",2
