tweet,rotulo
Bolsonaro é louco e eu sou o Lula jump jump jump,1
taehyung performando sentado sendo superior a qualquer um,0
Campanha de Bolsonaro quer evitar fake news nos celulares de assessores https://veja.abril.com.br/coluna/radar/campanha-de-bolsonaro-quer-evitar-fake-news-nos-celulares-de-assessores/…,0
Hipocrisia agente vê por aqui com a SIMONE ESTEPE.Lapada: Michelle Bolsonaro expõe “hipocrisia” de Simone Tebet; VEJA ☛,0
Meu Presidente tava aqui em São Luís e eu não pude ir ver ele. . .  @LulaOficial . . .#LulaNo1ºTurno #LulaPresidente13 #Lula13,1
o que eu mais quero do lula é que ele faça meu pai me dar um carro ano q vem,1
PARÓDIA CHAVES - LULA https://youtu.be/RYwJMVavJwU via @YouTube,1
"As vezes eu fico achando que Ciro Gomes viaja para o futuro, anota tudo e volta pra nos contar.Ciro Gomes precisa ser presidente do Brasil.",2
"Leia, escute, discuta, aprenda , evolua com Ciro Gomes . Ele pede isso , não se cala, busca o debate e solução . De esquerda ou direita não importa . Temos que encontrar saídas . Negar é auto sabotagem, ilusão e prejuízo assumido. Patriotas olham além de si mesmos",2
De perto e de longe é @cirogomes,0
"Adorei saber que eu e o BRESSER temos o mesmo candidato. Um antigo documentário sobre o Brizola se chama Coerência e Coragem. É isso, coerência e coragem. twitter.com/geofranzedias/…",0
"Vamos ver e escutar o candidato @cirogomes, que tem um projeto que mudará o Brasil!#CiroPresidente12 #CiroTV",0
"Hoje temos mais um encontro AO VIVO na #CiroTV – diretamente do Aglomerado da Serra, em Belo Horizonte! Acompanhe a transmissão do nosso quarto programa eleitoral completo, com direito a muitos reacts, interação com quem estiver participando e muito mais. Espero vocês às 20h45!",0
Hipocrisia agente vê por aqui com a SIMONE ESTEPE.Lapada: Michelle Bolsonaro expõe “hipocrisia” de Simone Tebet; VEJA ☛,0
Simone Tebet para presidente do Brasil,0
Acabei de ver Lapada: Michelle Bolsonaro expõe “hipocrisia” de Simone Tebet; VEJA - Clique para ver também ☛  https://terrabrasilnoticias.com/2022/09/lapada-michelle-bolsonaro-expoe-hipocrisia-de-simone-tebet-veja/… via @TerraBrasilnot,0
"Olha aí o FIES, olha aí o Bolsonaro auxiliando as pessoas a se reerguerem.",0
"Meu irmão tinha uma dívida de R$11.300,00 no FIES.Ontem esteve na caixa e renegociou sua dívida, recebeu 77% de desconto e pagou por R$2.600,00 dos mais de 11k que devia.Obrigada PR @jairbolsonaro e @caixa_ouvidoria",0
"O povo brasileiro  só  vai conhecer  as falcatruas  de Bolsonaro  a partir  de 2023, quando ele deixar  o governo.",0
"o olho roxo vai embora, agora as botada que dei no seu namorado tu não vai desbotar",0
É o renanzinho bolsonaro?,0
"Eu falo isso aqui faz anosImpossível negar a corrupção descoberta na lava jatoNo entanto, cadê o dinheiro que o lula roubou? Cadê os imóveis, as viagens pro exterior? A vida de luxo? Se ele roubou tanto pq nem ele nem ninguém da família usufrui?",1
"""Por que vc vai votar no Lula sendo que ele roubou tanto?""Bom, aí está minha resposta:",1
Ministro do TSE manda apagar post de Latino com fake news sobre Lula,1
"Chupa Felicianus e Malacraia!!!Fake news sobre Lula e fechamento de igrejas se espalhou, mas 78% não acreditaram, diz Ipespe",1
Pra quem tem dúvidas sobre o programa Renda Mínima do @cirogomes ele mesmo explica. ,0
Tem duas perguntas sobre nosso RENDA MÍNIMA DE R$ 1.000 que têm aparecido com frequência aqui nas redes e por onde a gente tem andado. ,0
"Só para aqueles do PDT que ficaram com raiva da gentee dos  @cristaostrabpdt, quando fizemos campanha para o @CaboDaciolo ser Senador, os desígnios de Deus sabia quem nunca iria trair @cirogomes !!",0
"Estou vendendo meus NFTS Card Legend política 8 mil cada Lula , Bolsonaro ,Ciro Gomes Está disponível  na #OpenSea  #política #card #Cup #cirogomes #legend #gold #nft",2
Será q esquerdista @simonetebetbr está vendo esse mar de mulheres apoiadoras do guerreiro e trabalhador PR @jairbolsonaro?@MDB_Nacional @MichelTemer .Ah! Sou mulher paulistana e voto no Bolsonaro. #BolsonaroReeleitoEm2022 @CNNBrasil @g1 @RedeTV @VEJA,0
"“Diz pra votar em mulher e tenta calar outra mulher”, diz MichellePrimeira-dama evitou citar nomes, mas fez referência a uma ação interpelada por Simone Tebet",0
"Mulheres pela vida, mulheres pela família, mulheres com Bolsonaro. 03-09-2022Novo Hamburgo - RS #BolsonaroNoPrimeiroTurno",0
"Vamos conscientizar que este vídeo, não pode ser retuitado porque a Dona Simone Tebet não quer#MichellePelasMulheres",0
Eleitores de Ciro é Bolsonaro no 2o turno.. Isso se  @jairbolsonaro  não ganhar no primeiro turno!!,0
Curiosidade: A carta em defesa a democracia que a Rosângela Moro assinou não falava nada sobre ditadura da toga? Se Lula e a turma que “defende a democracia” voltar ao poder ele manda prender o Moro em menos de 30 dias.,0
Amo o Lula Molusco,1
Kkkkkkkkkk! Então Lula já está governando??? Mas  nem votamos ainda Marreco!!!,1
Moro chama de ‘abusiva’ busca em sua casa para apreensão de material de campanha e atribui ao PT ‘tentativa de intimidação’: https://bit.ly/3ejnBLV,0
Está mais que óbvio que o sistema está agindo para ter o bandido Lula de volta ao poder. Não podemos ter esse câncer de volta!,1
O PT pediu e o STF anulou as condenações do Lula. O PT pediu e o TRE-PR confiscou material de campanha do @SF_Moro e do @PauloMartins10 . Olha o poder que o PT já tem sem estar no governo. Essa é a verdadeira ameaça à democracia. PT nunca mais! https://oglobo.globo.com/politica/eleicoes-2022/noticia/2022/09/apos-pedido-do-pt-sergio-moro-e-alvo-de-busca-e-apreensao-de-material-de-campanha-em-sua-casa.ghtml…,0
"Nossa vice,  @AnaPaulaMatosBA , explica como vai funcionar o programa de renda mínima proposto pelo Ciro Gomes. ",2
"Depois eu digo que é coisa de maluco. Ele claramente teve problemas no material de campanha, tanto que assumiu isso. E a culpa não é dele? Não, é do PT. Ciro Gomes, falou besteiras num comício, culpa dele? Não, do Lula. Gente, não tem um amigo próximo pra dar um conselho não? ",2
Eleições 2022: Moro critica PT e chama operação em sua casa de abusiva https://www1.folha.uol.com.br/poder/2022/09/moro-critica-pt-e-chama-operacao-em-sua-casa-de-abusiva.shtml?utm_source=twitter&utm_medium=social&utm_campaign=twfolha…,0
"Teto do Ciro Gomes é de 12%, só vai desperdiçar parcos recursos do PDT.",2
eu quero que vocês deem essas moedas pra simone tebet:,0
"""Mulheres votam em mulheres !"" Declara Simone Tebet  ""Nós votamos no MITO"" Respondem mulheres gaúchas para @jairbolsonaro  em encontro no RS !!!  #MulheresComBolsonaro",0
"Obrigado feminista  @simonetebetbr , conseguiu transformar esse vídeo no mais visto em todas redes sociais. Continue assim Senadora 3%!",0
"o TSE acatou com o pedido da Simone estepe e mandou remover o vide de campanha com a primeira dama Michele Bolsonaro , estou fazendo minha parte e vamos Retwitar com força ! ",0
Acabei de ver Lapada: Michelle Bolsonaro expõe “hipocrisia” de Simone Tebet; VEJA - Clique para ver também ☛  https://terrabrasilnoticias.com/2022/09/lapada-michelle-bolsonaro-expoe-hipocrisia-de-simone-tebet-veja/… via  @TerraBrasilnot,0
"""sou mulher, tenho mais de 18 e voto no Bolsonaro! Bom, eu tenho uma péssima notícia pra ti""  Ja se dizia antes nesta rede social.",0
"Em ato no RS, Bolsonaro pergunta se mulheres prefeririam 'Lei Maria da Penha ou uma pistola' em situação de perigo http://glo.bo/3Qk3o5Y #g1",0
Faltam 29 Para #LulaNo1ºTurno e #BolsonaroNaCadeia  Pois o povo não é bobo e vai querer ser feliz de Novo E não para de gritar  EI BOLSONARO VAI TOMAR NO CU!!!!!,0
Bolsonaro e o teatro dos horrores.,0
A profecia do Lula se cumprindo! Grande Dia!,1
Justiça Eleitoral realiza busca e apreensão na casa do marréco e parcial Sergio Moro para apreender material de campanha irregular. #lula2022 #forabolsonaro #cadeianomoro,1
ESTOU COM LULA! Pelo Brasil da esperança! Faltam 29 dias...  #LulaPresidente13 #LulaNo1ºTurno #BrasilDaEsperança,1
TSE determina que redes sociais derrubem postagens do cantor Latino contra Luiz Inácio Lula da Silva,1
"Enquanto militantes de #CiroGomes e #Lula se atacam, deixam rolar #fakes de #bolsonarocorrupto",1
"OFICIALMENTE DEFINIDO  Dep. Estadual -  @leticiaarsenio  19019 Dep. Federal -  @caleromarcelo  5501 Senador -  @alessandromolon  400 Governador -  @nulo  00 Presidente -  @cirogomes  12  Os votos são meus e quem n gostou, fodac e abraço.  Vamo!!!",0
"o Ciro Gomes  causa uma boa impressão, entre todos os candidatos é oque tem a melhor oratória",2
"Pera lá um pouquinho, eu gosto do jeitão do Ciro Gomes",2
Acabei de ver Lapada: Michelle Bolsonaro expõe “hipocrisia” de Simone Tebet; VEJA - Clique para ver também ☛  https://terrabrasilnoticias.com/2022/09/lapada-michelle-bolsonaro-expoe-hipocrisia-de-simone-tebet-veja/… via  @TerraBrasilnot,0
Não compartilhe  Simone tebet não gosta  #BolsonaroNoPrimeiroTurno,0
"Se eu fosse votar baseada no que está escrito nos planos de governo dos candidatos, meu voto seria da Simone Tebet, mas (MAS!!) como eu dou meu voto por outros motivos (principalmente tirar o que lá está) e não quero arriscar, então não será dessa vez! ",0
O ATIVISMO cada dia mais forte.  Aonde Vamos Parar. Acabou a LIBERDADE de VEZ. Você não é mais dono do seu nariz.  Atitudes JÁ,0
É por isso que o Bolsonaro PRECISA ganhar essa eleição !!!,0
"Posto Ipiranga na subida da Grajaú - Jacarepaguá no Rio de Janeiro. Obrigada, meu presidente ⁦ @jairbolsonaro ⁩ ",0
"Eu pra ser sincero já tô saco cheio com esse poderes que estão colocando sobre nossa país STF e TRE, poderes de merda e só vai piorar viu, eles vão fazer com o Bolsonaro o que fizeram com Donald Trump, minha amiga comentou do lá EUA, faz 20 min da inflação deles.",0
ESTOU COM LULA! Pelo Brasil da esperança! Faltam 29 dias...  #LulaPresidente13 #LulaNo1ºTurno #BrasilDaEsperança,1
"Os funcionários do PT estão perseguindo todos aqueles que apoiam o presidente Bolsonaro, estamos vivendo numa ditadura.  TSE determina que redes sociais derrubem postagens do cantor Latino contra Luiz Inácio Lula da Silva ☛",1
#Lulaladrão lula é  bandido,1
Torno a dizer que não julgo quem vota em Ciro Gomes,2
Voto Útil não vai para Inúteis Aqui é Ciro Gomes!!!  #cirogomespresidente  #cirogomes2022  #Ciro12  #CiroPresidente12,2
Minha colinha no RS  Presidente:  @cirogomes  12  Governador:  @VieiraPDT  12 Senador:  @Profnado  700 Dep. Federal:  @JulianaBrizola  1234 Dep. Estadual:  @EngZini  12120  E a de vocês?,0
Minha colinha em Santa Catarina:   Presidente: @cirogomes 12  Governador: @jorgeboeira_ 12 Senadora: @hildadeola 123  Dep. Federal: @JordanaSage_ 1200 Dep. Estadual: em dúvida  E a de vocês?,0
"Corre aqui rapidão  @simonetebetbr  ... quis calar a voz da 1a Dama, mas estaremos, todos dias, postando.  Só acho  #BolsonaroTemRazao",0
Esse é o vídeo vetado?!,0
Isso aqui é muito bom.,0
"Debate mudou alguma coisa na corrida presidencial?  Lula se manteve estável e Jair Bolsonaro acabou variando um ponto para baixo. Com margem de erro de 2 pontos, nada mudou. Simone Tebet manteve os 4% da pesquisa anterior. #NemJair #NemSimone ",0
"vou pra passeata de Bolsonaro com mãe, quem vai comigo? quero dar um beijo gay lá no meio",0
Justiça eleitoral determina busca e apreensão na casa de Sergio Moro #CNNnasEleições https://cnnbr.app/short/c2005214590/…,0
"BOLSONARO MENTE SOBRE O AUXÍLIO DE 600,00. CANALHA!!!",0
"LULA GENOCIDA! LULA GENOCIDA!! LULA GENOCIDA!! PODE, CARMEM LUCIA CALA A BOCA JÁ MORREU!!??",1
"Me fala o nome de 1 daqueles 9 , que foram colocados por outros governos, que tenha caráter, vergonha na cara, não tem são uns canalhas.",0
Sempre foi. Mas o desespero ta batendo.  @LulaOficial  por favor! Vc vai ganhar. E em um decreto só ACABE COM O SIGILO DE 100 ANOS. Queremos ver esse verme na cadeia!,0
"Acho que Bolsonaro está um pouco perdido. Ele mesmo não nega que não sabe governar, que não entende de política, nem de economia.",0
Bora decidir no primeiro turno! Lula 13 presidente! Pesquisa Presidencial IPESPE de 30/08 a 01/09:   Lula (PT): 44%  Coiso (PL): 35%  Paris (PDT): 9%  Tibiti (MDB): 5% Os demais candidatos pontuaram 1% ou menos  Brancos e Nulos: 3%  Indecisos: 2%,1
"Ouça da boca do próprio Ciro Gomes:   ""Não acho que Lula seja ladrão; nunca disse isso""",2
"A matemática petista é matemática de malandro passando troco pra cego. Em um universo de 100%, se alguém aumenta seu percentual de votos, outro alguém os terá diminuídos. Se  @cirogomes  aumenta seus votos,  @jairbolsonaro  ou  @LulaOficial , automaticamente,  perderão votos. ",0
Viu isto  @cirogomes  .  #LulaPresidente13 #LulaNo1ºTurno,0
Não é estranho q Circo Gomes  e Simone Tebet tenham os medmos percentuais em 2 pesquisas diferentes ( Datafolha e XP Ipespe) ? Está me cheirando a armação para forçar a eleiçào p/ o 2° Turno !,2
Só mais um pouquinho  @simonetebetbr,0
Simone não quer que as mulheres saibam o que o governo está fazendo.,0
Mulheres com o Bolsonar!! elas amam o Pres1dente!!  (com todo respeito Michelle),0
Corre aqui  @simonetebetbr,0
"Em apenas 10 horas, a odd do Lula caiu de 1.80 para 1.61, enquanto a de Bolsonaro subiu de 1.90 para 2.20.  Informação do robô de odds  @bot365br",1
"Deve see difícil ser Rockeiro e Bolsonarista né. Não pode nem ir mais em show de Rock sem passar raiva com a galera gritando ""HEY BOLSONARO VAI TOMAR NO C*""   Daqui a pouco só vai sobrar boteco do Gustavo Lima pra esses Bolsonaristas Rockeiros irem ",0
"Sérgio Moro traiu Bolsonaro a pedido do Dória que também tentou puxar o Paulo Guedes, sem sucesso. Mesmo assim, nós eleitores de Bolsonaro, não podemos compactuar com essa ação arbitrária ""a mando"" do PT. Isso é a maior prova do aparelhamento da Justiça com a esquerda corrupta.",0
"Em apenas 10 horas, a odd do Lula caiu de 1.80 para 1.61, enquanto a de Bolsonaro subiu de 1.90 para 2.20.  Informação do robô de odds  @bot365br",1
a carreata do júnior mano passando na minha rua e minha irmã gravando pensando que era a do lula kakakakakakakkakakakak,1
Imagina quando lula for eleito a festa que Olinda vai antecipar o carnaval de Pernambuco.,1
Eita povo lindo! Dá gosto de ouvir! Aqui em Pernambuco miliciano genocida não se cria! #LulaNoPrimeiroTurno ,0
Quem vota no Ciro Gomes não está tão preocupado assim se o Bolsonaro for reeleito.,2
"Começa assim: ""se você votar no Bolsonaro, você é fascista"". Em seguida, ""se você votar no candidato que tira voto do Lula, então é fascista"". Por fim, ""se você não votar no Lula, só pode ser  fascista mesmo"". Lembrando que, claro, tudo isso é em nome da mais fofa democracia.",1
Olha vou ser bem sincero! Não aperto 22 e 13 nem no elevador!   Mas estou seriamente pensando e apertar o 12!   Tenho críticas ferrenhas ao  @cirogomes ! Mas é um cara que pelo menos não vai se juntar ao PT e nem ao Bolsonarismo! Acho pq na hora não sei...  Diz aí  @cirogomes,0
"Ouça da boca do próprio Ciro Gomes:   ""Não acho que Lula seja ladrão; nunca disse isso""",2
O homem é o lobo do homem.  Né não  @simonetebetbr,0
Olha isso dona  @simonetebetbr,0
Fala Primeira Dama..para as Mulheres do Brasil.,0
Simone não quer que as mulheres saibam o que o governo está fazendo.,0
Recordando para as defensoras... @simonetebetbr   @SorayaThronicke,0
"Quando eu fiz esse recorte do Otto Alencar fazendo isso com Nise Yamaguchi eu quase perdi minha conta de tanto que xinguei esse cara.  Simone Tebet que ""cala mulher"" não disse um ""pio""   Relembre quem é e como age o lulista, Otto Alencar ""que deu o ESCULACHO naquela japonesa.""",0
daria meu cu 29 vezes para o bolsonaro para ir no show do alok no rock in rio,0
Governo Bolsonaro chama servidores para 7 de Setembro,0
To cada dia mais convicto de que minha teoria sobre o Bolsonaro tá correta e um dia isso vai vazar na mídia,0
O bolsonaro tá pouco se fudendo para os pobres,0
Encontro com quebradeiras de Coco do Maranhão.   : @ricardostuckert,0
É Lula de novooooo....vivaaaaaaa.,1
"Partidos da ""base de apoio"" de  @alvarodias_   e o  @PodemosSenado   em sua ""coerência""; PT, PC do B, PV. Entram com ação INTIMIDATÓRIA contra candidatura de  @SF_Moro  ... Interessante são seus apoiadores: Lula, José Dirceu, Renato Duque, Que vexame! Só condenados por corrupção! ...",1
O Lula chama o Bolsonaro de genocida e o TSE não faz nada.  O Sérgio Moro sofre busca e apreensão por usar um tamanho de fonte não apropriado.  Cadê a resistência burra?,1
Se defende  @cirogomes  . Vai me dizer que é Fake News ?,0
É doloroso acreditar que cena tão chocante aconteça no nosso Brasil. Impossível alguém assistir este vídeo e não se sentir um bebê desprotegido ou uma mãe em desespero. Punição rigorosa para este monstro!,0
A fraude do ensino em SOBRAL-CE,0
Meu Deus!! Ciro gomes é uma fraude. Que absurdo isso!!,2
A fraude do ensino em SOBRAL-CE,0
"Primeira-dama evitou citar nomes, mas fez referência a uma ação interpelada por Simone Tebet",0
Obrigado pela divulgação   @simonetebetbr  que tiro no pé ,0
"Vamos compartilhar ainda mais!  Você não me representa ""Stebetch""  A Michele Bolsonaro sim me representa!!",0
eu quero que vocês deem essas moedas pra simone tebet:,0
FIQUE POR DENTRO  BOMBA! URGENTE! CENSURA!  MInistro Alexandre de Moraes/TSE mandou retirar todas as FOTOS do presidente BOLSONARO!!!  Está acontecendo somente em Uberlândia ou também em todo o Brasil? Dia 07 de Setembro será TSUNAMI.,0
Ei Bolsonaro vai toma Cu !!!  @AndreJanonesAdv   @LulaOficial   vai ser no primeiro TURNO,0
Olha que legal! @medoedeliriobr #ForaBolsonaro #RockInRio,0
"Quando falam q o Bolsonaro é Mito, alguns colocam em dúvida, mas vejam o q ele fez. Fez a Globo mudar até a logo das eleições, kkkkkkk",0
Ei Bolsonaro vai toma Cu !!!  @AndreJanonesAdv   @LulaOficial   vai ser no primeiro TURNO,0
Olha que legal! @medoedeliriobr #ForaBolsonaro #RockInRio,0
eu vou desvirar petista não tô brincando lula derruba isso,1
Lula roubou a brisanet,1
"Diz a lenda que irrita o tchutchuca chamar ele de tchutchuca, então não usem esse áudio nem decorem a dancinha da Tchutchuca do Centrão, hein?  Faltam 5 semanas! ",0
cirogomes: É doloroso acreditar que cena tão chocante aconteça no nosso Brasil. Impossível alguém assistir este vídeo e não se sentir um bebê desprotegido ou uma mãe em desespero. Punição rigorosa para este monstro!,0
"cirogomes: Hoje temos mais um encontro AO VIVO na #CiroTV – diretamente do Aglomerado da Serra, em Belo Horizonte! Acompanhe a transmissão do nosso quarto programa eleitoral completo, com direito a muitos reacts, interação com quem estiver participando e…",0
Amazônia hoje! Vergonha nacional!  @governofederal  @governofederaal  @agenciapublica  @InfoAmazonia  @gov_pf  @randolfeap  @JanainaDoBrasil  @felipeneto  @Zambelli2210  @SF_Moro  @alexandre  @LRobertoBarroso  @cirogomes  @inmet_  @dsrinpe  @gov_mcti,0
"Olha ele aí de novo!!! Vou rtt até cansar. E quando cansar, vou rtt novamente, só porque a  @simonetebetbr  não quer ",0
pois é né amigo - esse vídeo sempre insiste em voltar em nossa time line - acho que é porque é uma lindeza só twitter.com/TOMAZ_CHACAL/s…,0
ainda impactado com a gay me dizendo ontem que vai votar na Simone Tebet.,0
"Lula, Ciro e Tebet se solidarizam com Kirchner; Bolsonaro 'manda notinha'",1
"Ela é bem grandinha, a mulher do Bolsonaro é atacada também eu não vi o Sr se indignar. “Gabinete do ódio” só de um lado? O Sr tem um passado que não o qualifica para defender as mulheres. Mais ódio que o Lula destila não tem pra ninguém.",0
"Bolsonaro e seu gabinete do ódio resolveram atacar a advogada e apresentadora Gabriela Prioli. A tentativa de intimidação é grave e deve ser investigada. Minha solidariedade, @GabrielaPrioli.",0
falando sério. o inimigo número um do Bolsonaro é ele mesmo. se não abrir o olho ainda prejudicar as carreiras dos filhos.porque  ele já tá velho. só sabe dar mal exemplo pro filhos. boa noite.,0
"É O ODIADO PELO ""CRAMULHÃO"" @paura_patricia  @jairbolsonaro  @carlosjordy  @FlavioBolsonaro  @DireitaRio2017  @ptb14",0
"Lula, Ciro e Tebet se solidarizam com Kirchner; Bolsonaro 'manda notinha'",1
"Ela é bem grandinha, a mulher do Bolsonaro é atacada também eu não vi o Sr se indignar. “Gabinete do ódio” só de um lado? O Sr tem um passado que não o qualifica para defender as mulheres. Mais ódio que o Lula destila não tem pra ninguém.",0
"Bolsonaro e seu gabinete do ódio resolveram atacar a advogada e apresentadora Gabriela Prioli. A tentativa de intimidação é grave e deve ser investigada. Minha solidariedade, @GabrielaPrioli.",0
Até eu que fiquei do lado dele de 2018 até 2021 vou votar no Lula pra evitar isso,1
Quer votar no Ciro? Vota. Mas assuma a responsabilidade que ao votar no Ciro e tebet a única coisa que vc está fazendo é criar um cenário de segundo turno para o Bolsonaro. É isso,2
"A VERDADE SEMPRE VENCE! Brasil, urgente! Lula PRESIDENTE! https://instagram.com/p/CiDysfRuBF3KxbEj3iSuvhcCM6rtboEqF9DcUc0/?igshid=YTgzYjQ4ZTY=…",1
Lula e Sergio Moro: Teatro.   Ciro Gomes: educação  ,2
"'Não me intimidarão', diz Moro após busca e apreensão a pedido do PT https://zpr.io/UGFwCyJcC4Y8",0
Ciro Gomes está confiante e isso dá confiança aos militantes e eleitores. E causa aflição aos adversários.,2
"Independente do resultado das eleições o Ciro Gomes já venceu pois são as ideias que ele apresentou nos últimos anos que pautam o debate brasileiro.   Todos os adversários copiam suas propostas, a questão é: será que esses vão cumprir ou querem apenas seu voto?",2
Seu precioso voto é a chance que Ciro Gomes precisa para mudar o Brasil pra melhor! Precisamos de PAZ e muito trabalho! #CiroPresidente12  @cirogomes,2
Receba!! @simonetebetbr,0
Interrompemos Nossa Programação para a Propaganda Eleitoral Gratuita @simonetebetbr,0
"“Simone Tebet está com as mãos manchadas de sangue indígena do MS”, diz ... https://youtu.be/3HPKXJgM86s via  @YouTube",0
O qq esse povo almoça pra jogar voto fora em Simone tebet???,0
Bolsonaro genocida  Fora Bolsonaro  Bolsonaro miliciano/família quadrilha Pai  @LulaOficial  você me representa.,0
Nossa!! Nunca ouvi falar do seu nome Isso é fake News? Fora Bolsonaro Fora genocida,0
"Alguém do  @TSEjusbr  vai banir vídeos de ""artistas"" contra o Presidente  @jairbolsonaro , se forem provocados?",0
Artista só pode se posicionar se for pra apoiar Ladrão  Tudo pela lisura do processo eleitoral,0
Eu quero ver a família bolsonaro na PRISÃO!,0
"obviamente o  @LulaOficial  não vai ganhar; com ele, a melancia socada dentro do seu cu seria da grande; com  @jairbolsonaro  e militância vai ser a mesma coisa porém empedernidos de base maqueávica eles iludem ainda mais otários #bolsonarista",0
"Sabemos o real motivo da chapa Alckmim e Lula, nada mais e nada menos que sintonia de caráter. Um bebe e outro come a merenda. ",1
"Cerco a carro de candidato, drone com veneno, bomba caseira, assassinato de militante político em aniversário, atentado na Argentina, troca de tiros dentro de igreja por discussão política em Goiás: e ainda me perguntam por qual razão me uni ao presidente @LulaOficial +",0
Lula não foi machista ao falar a seus eleitores no Maranhão! Ele tem defendido mais direitos para as mulheres e feito discursos históricos contra a cultura do patriarcado. A manchete maldosa do jornal Estadão (que gafe!) espalhou a mentira.  https://verdadenarede.com.br/lula-quer-mais-direitos-para-as-mulheres-e-nao-foi-machista-2/…,1
O Ciro Gomes precisa se tornar presidente do Brasil para melhorar a educação do nosso povo. Esse aqui faltou as aulas de matemática básica.,2
"Dica aos militantes do Ciro Gomes: se vocês querem mesmo fazer o Ciro subir, não se preocupem com hashtag no Twitter, mas sim em fazer o dever de casa: convencer seus familiares a votarem nele.",2
Lula e Sergio Moro: Teatro.   Ciro Gomes: educação  ,2
"'Não me intimidarão', diz Moro após busca e apreensão a pedido do PT https://zpr.io/UGFwCyJcC4Y8",0
TSE acatou pedido da Simone Tebet pra tirar este vídeo do ar.  Simone Estepe não quer que as mulheres saibam o que o governo está fazendo.  @simonetebetbr   então vamos divulgar Patriotas #Bolsonaro22 #SouMulherEVotoBolsonaro,0
"Simone Tebet é a terceira vaia da Globo, né? Depois de Dória e Moro.",0
Bolsonaro diz que operação contra empresários aconteceu após “vagabundo” dar canetada. Busca e apreensão da Polícia Federal foi autorizada por Alexandre de Moraes após o Metrópoles revelar a defesa de um golpe de Estado em grupo de WhatsApp.,0
"bin mandando um ""ei bolsonaro vai tomar no cu"" no meio do palco do rock in rio QUE HOMEM",0
CHAMOU O BOLSONARO DE BURRO E AGORA PASSA VERGONHA ! https://youtu.be/kFPabdVddd8 via  @YouTube,0
Eu acho o renan bolsonaro bonitinho,0
"LULA QUER DIVIDIR O BRASIL ENTRE MINORIAS  ""Nós vamos recriar o Ministério das Mulheres. Nós vamos criar um Ministério dos Povos Originários. Nós vamos criar o Ministério da Igualdade Racial. Quero que todo mundo tenha o direito de ter o mínimo necessário."" PIADA?",0
mulher? que não vai votar no lula? veio com defeito gatinha ,1
minha mina disse que pós-endoscopia eu fiquei pedindo votos para o lula,1
Votar Nulo = não decide eleição  Votar Ciro = Bolsonaro no 2 turno Votar Simone = Bolsonaro 2 turno  VOTE LULA 13 !   #LulaNoPrimeiroTurno  @LulaOficial,0
Quem será o Lula do troco no ano que vem? A) Deus B) São Jorge C) Beth Faria,1
gente se duvidar ate minha mae pra síndica do prédio faz mais votos que o ciro gomes votar nesse homem é apenas dar uma oportunidade pro bolson*ro vencer,2
"Procede, Seu Ciro  @cirogomes  ?",2
