tweet,rotulo
Quer votar no Ciro? Vota. Mas assuma a responsabilidade que ao votar no Ciro e tebet a única coisa que vc está fazendo é criar um cenário de segundo turno para o Bolsonaro. É isso,2
Os grampos telefônicos são uma ação do Bolsonaro para deslegitimizar os avanços da democracia! #DesculpasDoPT,0
péssima notícia para Lula e Ciro https://fb.watch/fk2ODaVCi8/ via  @FacebookWatch,1
"DATAFOLHA joga BALDE de ÁGUA FRIA no LULA e, ao final, CORRUPÇÃO e ECONOMIA é o que vai DECIDIR",1
"Em 2018, apenas Ciro gomes venceria Bolsonaro no segundo turno. (https://veja.abril.com.br/politica/no-2o-turno-bolsonaro-so-perde-para-ciro-e-alcanca-haddad-diz-ibope/…) Alguem quer apostar em quem o cidadao abaixo votou no primeiro turno?",2
"Parem de bobagem. Se Ciro conseguir o milagre de duplicar os seus votos... Passando de 9(!) para 18%, quem vai para o segundo turno? Bolsonaro. E se Ciro TRIPLICASSE seus votos? Passado de 9 para 27! Quem iria para o segundo turno? Bolsonaro.  Não sejam linha auxiliar do fascismo",2
FALOU TUDO QUE PENSO twitter.com/keldavidd/stat…,0
"Que orgulho desse irmão! Os crentes precisam se pronunciar, púlpito não é palanque. Esses lugares foram transformados para os interesses dos lobos roubadores.  @cirogomes  usa esse vídeo para chamar os verdadeiros cristãos a tomarem posição e rejeitar politicagem na igreja.",0
"Eu sou Pastor Batista devidamente filiado na OPBB. Quero parabenizar esse irmão Batista que protestou essa politicagem em uma reunião oficial da OPBB-SP, vc é uma luz que brilha em meio a uma escuridão. No vídeo normal o @astro_pontes tinha acabado de se apresentar. @pavarini",0
queria que a simone tebet privatizasse a minha xot,0
"-  Em tempos onde Simone Tebet, que diz defender mulheres, pediu a retirada de material da Primeira-dama Michelle Bolsonaro, vamos fazer nossa parte divulgando o máximo que pudermos!!! Vc me ajuda nessa?  -",0
BOLSONARO 22  BOLSONARO 22  BOLSONARO 22  BOLSONARO 22  BOLSONARO 22  BOLSONARO 22  BOLSONARO 22                            BRASIL ACIMA DE TUDO E DEUS ACIMA DE TODOS,0
APÓS QUASE 2000 ANOS A MESMA PERGUNTA ECOA RETUMBANTE... VOCÊ ESCOLHE O MESSIAS OU O LADRÃO?,0
"Bolsonaro atacar a Lei Maria da Penha para defender, que as mulheres preferem armas às leis, é um achismo da demência dele que não condiz com a realidade da maioria das mulheres. É Jair vazando porque ninguém mais aguenta essa vergonha de presidente.",0
"Melhor parte dos eventos é quando todos se juntos em uma só voz para entoar os cânticos dos Deuses. Começa assim oh:  ""Ei Bolsonaro, vai toma no cu""",0
"Traidor é tão anta q o q diz só faz dizer q Jair está fazendo tudo certo. Engraçado q o Moro nunca falou do lula antes, só contra o Bolsonaro. Moro lança vídeo revoltado com o PT e, sem perceber, exalta ação de Jair Bolsonaro (",0
"Já que o Felipe Neto falou que o Lula não roubou nada ,blz .Mas serâ que ele poderia como Garoto Propaganda responder sobre isto aqui?",1
"Traidor é tão anta q o q diz só faz dizer q Jair está fazendo tudo certo. Engraçado q o Moro nunca falou do lula antes, só contra o Bolsonaro. Moro lança vídeo revoltado com o PT e, sem perceber, exalta ação de Jair Bolsonaro (",0
*toca o funk que a valesca popozuda fez para o Lula *,1
"Em 2018, apenas Ciro gomes venceria Bolsonaro no segundo turno. (https://veja.abril.com.br/politica/no-2o-turno-bolsonaro-so-perde-para-ciro-e-alcanca-haddad-diz-ibope/…) Alguem quer apostar em quem o cidadao abaixo votou no primeiro turno?",2
"Parem de bobagem. Se Ciro conseguir o milagre de duplicar os seus votos... Passando de 9(!) para 18%, quem vai para o segundo turno? Bolsonaro. E se Ciro TRIPLICASSE seus votos? Passado de 9 para 27! Quem iria para o segundo turno? Bolsonaro.  Não sejam linha auxiliar do fascismo",2
FALOU TUDO QUE PENSO twitter.com/keldavidd/stat…,0
"Que orgulho desse irmão! Os crentes precisam se pronunciar, púlpito não é palanque. Esses lugares foram transformados para os interesses dos lobos roubadores.  @cirogomes  usa esse vídeo para chamar os verdadeiros cristãos a tomarem posição e rejeitar politicagem na igreja.",0
"Eu sou Pastor Batista devidamente filiado na OPBB. Quero parabenizar esse irmão Batista que protestou essa politicagem em uma reunião oficial da OPBB-SP, vc é uma luz que brilha em meio a uma escuridão. No vídeo normal o @astro_pontes tinha acabado de se apresentar. @pavarini",0
"-  Em tempos onde Simone Tebet, que diz defender mulheres, pediu a retirada de material da Primeira-dama Michelle Bolsonaro, vamos fazer nossa parte divulgando o máximo que pudermos!!! Vc me ajuda nessa?  -",0
queria que a simone tebet privatizasse a minha xot,0
É Jair ou já era! Vambora #B22,0
"A esquerda quando vê isso morre de raiva, Jair Messias Bolsonaro o melhor presidente do Brasil de todos os tempos.",0
Atenção  @STF_oficial Bolsonaro fala em 'canetada' de 'vagabundo' ao atacar decisão de Moraes contra empresários,0
"Vamos eleger #LulaNo1ºTurno. Essa eleição é diferente. Temos menos de 1 mês, o cenário já está consolidado. Há dois candidatos e Lula tem chance de vencer agora. Vamos resolver essa eleição no dia 02/10. É #LulaPresidente13",0
"É preciso evitar o crescimento da QUINTA COLUNA composta por CIRO E TEBET. As forças golpistas estão apostando fortemente nos dois para colocar BOLSONARO no segundo turno, com dois objetivos: 1. Reeleger o monstro. Ou, 2. Enfraquecer a vitória de Lula para por a faca no pescoço",1
"Tudo q foi feito na Argentina, Lula quer fazer no Brasil. Viram como Argentina ficou um país melhor .",1
Lula ou Bolsonaro? nas ruas de Curitiba #13 https://youtube.com/shorts/f_sWCSyezy8?feature=share… via  @YouTube,1
"Meu sonho é um dia conseguir me aposentar pra ter tempo de escrever um livro. A história já tá toda na minha cabeça, haha. Espero não esquecê-la daqui pro final da minha vida, pq sabe-se lá quando é que a nossa geração vai conseguir se aposentar... Lula, tô contando com vc kkkk",0
"Eu sou Pastor Batista devidamente filiado na OPBB. Quero parabenizar esse irmão Batista que protestou essa politicagem em uma reunião oficial da OPBB-SP, vc é uma luz que brilha em meio a uma escuridão. No vídeo normal o @astro_pontes tinha acabado de se apresentar. @pavarini",0
"Que orgulho desse irmão! Os crentes precisam se pronunciar, púlpito não é palanque. Esses lugares foram transformados para os interesses dos lobos roubadores.  @cirogomes  usa esse vídeo para chamar os verdadeiros cristãos a tomarem posição e rejeitar politicagem na igreja.",0
FALOU TUDO QUE PENSO twitter.com/keldavidd/stat…,0
"Parem de bobagem. Se Ciro conseguir o milagre de duplicar os seus votos... Passando de 9(!) para 18%, quem vai para o segundo turno? Bolsonaro. E se Ciro TRIPLICASSE seus votos? Passado de 9 para 27! Quem iria para o segundo turno? Bolsonaro.  Não sejam linha auxiliar do fascismo",2
"Em 2018, apenas Ciro gomes venceria Bolsonaro no segundo turno. (https://veja.abril.com.br/politica/no-2o-turno-bolsonaro-so-perde-para-ciro-e-alcanca-haddad-diz-ibope/…) Alguem quer apostar em quem o cidadao abaixo votou no primeiro turno?",2
"Simone Tebet (MDB) votou no Senado alinhada com o governo Bolsonaro em 85% das ocasiões. Soraya Thronicke (União Brasil), 89%. Incrível que agora ambas dizem que não concordam com nada, que farão diferente que as decisões serão outras,mas foram muito Governistas .",0
"Agora entendir a frase que vc disse na CPI das mentiras   @simonetebetbr  ,não é pq os governadores e prefeitos desviam dinheiro que têm que ser punidos,foi essa frase que vc quis dizer",0
"Se você vir um Bolsonaro de mala, saiba que ele está indo comprar um imóvel",0
Gostou Michelle Bolsonaro? #Eleições2022,0
Janja critica propaganda eleitoral sobre Rio São Francisco com Michelle Bolsonaro na TV: 'tão cara de pau'; http://glo.bo/3AJiX1n,0
Galera que está xingando o Bolsonaro no RIR,0
Canalhas hipócritas! Vão à merd@!,0
"‘Prefere Lei Maria da Penha ou uma pistola?’, pergunta coisa ruim em evento com mulheres  O mesmo foi assaltado com arma e tudo, detalhe; o bandido levou a arma dele #Forabolsonaro Agora é Lula 13  #BrasilDaEsperanca",1
"Em 2018, apenas Ciro gomes venceria Bolsonaro no segundo turno. (https://veja.abril.com.br/politica/no-2o-turno-bolsonaro-so-perde-para-ciro-e-alcanca-haddad-diz-ibope/…) Alguem quer apostar em quem o cidadao abaixo votou no primeiro turno?",2
"Parem de bobagem. Se Ciro conseguir o milagre de duplicar os seus votos... Passando de 9(!) para 18%, quem vai para o segundo turno? Bolsonaro. E se Ciro TRIPLICASSE seus votos? Passado de 9 para 27! Quem iria para o segundo turno? Bolsonaro.  Não sejam linha auxiliar do fascismo",2
FALOU TUDO QUE PENSO twitter.com/keldavidd/stat…,0
"Simone Tebet, responda-me, você sente muita dor? ou já se acostumou com a dor que a b_rr_c_ crônica causa!!",0
"Agora entendir a frase que vc disse na CPI das mentiras   @simonetebetbr  ,não é pq os governadores e prefeitos desviam dinheiro que têm que ser punidos,foi essa frase que vc quis dizer",0
"Simone Tebet (MDB) votou no Senado alinhada com o governo Bolsonaro em 85% das ocasiões. Soraya Thronicke (União Brasil), 89%. Incrível que agora ambas dizem que não concordam com nada, que farão diferente que as decisões serão outras,mas foram muito Governistas .",0
"Por onde andam os Ministros Kassio Nunes Marques e o André Mendonça??! Será que pelo menos aparecem no banco para sacarem seus salários? Ahh, isso eles não devem deixar de fazer, né? Só não servem para defender as Leis e os cidadãos de bem! @STF_oficial   @jairbolsonaro",0
Ué o machista não era Bolsonaro?,0
O Presidente rasga o verbo em defesa dos empresários!! Assiste aí  e compartilha!! ,0
Vantagem de  @Lulaoficial  sinaliza estar consolidada. Lula mantém vantagem ampla entre beneficiários do Auxílio Brasil - Politica - Estado de Minas,1
"É bom se habituar  O caso do idoso valente de Manaus, que chamou Lula de ladrão e foi ameaçado por valentões petistas, mostra que não é apenas o candidato que está despreparado para lidar com a reputação do ex-presidente.",1
"Em 2018, apenas Ciro gomes venceria Bolsonaro no segundo turno. (https://veja.abril.com.br/politica/no-2o-turno-bolsonaro-so-perde-para-ciro-e-alcanca-haddad-diz-ibope/…) Alguem quer apostar em quem o cidadao abaixo votou no primeiro turno?",2
"Parem de bobagem. Se Ciro conseguir o milagre de duplicar os seus votos... Passando de 9(!) para 18%, quem vai para o segundo turno? Bolsonaro. E se Ciro TRIPLICASSE seus votos? Passado de 9 para 27! Quem iria para o segundo turno? Bolsonaro.  Não sejam linha auxiliar do fascismo",2
FALOU TUDO QUE PENSO twitter.com/keldavidd/stat…,0
Vc já viu  @simonetebetbr  ?,0
Dra Nise Yamaguchi solta o verbo e desmente Simone Tebet; VEJA VÍDEO,0
"Simone Tebet, responda-me, você sente muita dor? ou já se acostumou com a dor que a b_rr_c_ crônica causa!!",0
"Agora entendir a frase que vc disse na CPI das mentiras   @simonetebetbr  ,não é pq os governadores e prefeitos desviam dinheiro que têm que ser punidos,foi essa frase que vc quis dizer",0
"Virada tava gostosinha, x sem peita Malou dms na foto de fora Bolsonaro",0
Bom dia  Fora bolsonaro,0
PRESO AGORA LULA VAI VOLTAR PARA A CADEIA!ANDRE MENDOÇA ACABA COM PLANOS... https://youtu.be/SQp0UJpA0Gw via  @YouTube,1
"Vc não reclamou da desproporcionalidade da coercitiva do Lula, né, querida?",1
"Com todo respeito à Justiça Eleitoral do Paraná, não consigo ver proporcionalidade na busca e apreensão determinada em desfavor de Sérgio Moro. Entrar na casa de um candidato, por causa do tamanho dos nomes dos suplentes?  Por que não só suspender a distribuição do material?",0
Lula la com dignidade para sorrir e brilhar a nossa estrelaaaa! #Lula,1
Programa Eleitoral - Presidente - Lula - Noite - 03/09/2022,1
"Em 2018, apenas Ciro gomes venceria Bolsonaro no segundo turno. (https://veja.abril.com.br/politica/no-2o-turno-bolsonaro-so-perde-para-ciro-e-alcanca-haddad-diz-ibope/…) Alguem quer apostar em quem o cidadao abaixo votou no primeiro turno?",2
"Parem de bobagem. Se Ciro conseguir o milagre de duplicar os seus votos... Passando de 9(!) para 18%, quem vai para o segundo turno? Bolsonaro. E se Ciro TRIPLICASSE seus votos? Passado de 9 para 27! Quem iria para o segundo turno? Bolsonaro.  Não sejam linha auxiliar do fascismo",2
FALOU TUDO QUE PENSO twitter.com/keldavidd/stat…,0
Chupa aí  @simonetebetbr  !!!,0
"Mulheres de todas as idades prestigiam o presidente @jairbolsonaro em Novo Hamburgo (RS). VAI SER NO 1º TURNO, com a bênção de Deus! #Bolsonaro22",0
Vc já viu  @simonetebetbr  ?,0
Dra Nise Yamaguchi solta o verbo e desmente Simone Tebet; VEJA VÍDEO,0
"Simone Tebet, responda-me, você sente muita dor? ou já se acostumou com a dor que a b_rr_c_ crônica causa!!",0
"Suspensão de 3 dias. Pq? Pq parece.  Parece o que? Não sei. Parece que alguém quis suspender e pronto, tá decidido. Afinal, parece né.  Parece que o STF, TSE e a mídia são contra o Bolsonaro. Parece que TSE conta os votos. Parece que o STF dá o aval. Parece que a mídia é cega.",0
"BOLSONARO & MICHELE BOLSONARO IMBATÍVEIS NO HORÁRIO ELEITORAL : MICHELLE esbanja simpatia e competência no horário eleitoral do Pres.Bolsonaro e a  ministra Maria Claudia Bucchianeri, do Tribunal Superior Eleitoral (TSE), restringiu primeira-dama, Michelle Bolsonaro, aparecer.",0
O Brasil é Bolsonaro!!,0
"bom dia compas,ótimo domingo a todos, vamos deixar pra  comemorar dia 2 a noite, agora  vamos atrás dos indecisos e dos votos do ciro,e sepultar  qualquer chance dessa raça ruim logo no primeiro turno, falta pouco. LULA PRESIDENTE ",0
QUAL O IMPACTO DE VIRTUAL DERROTA DE LULA SOBRE A ESQUERDA? https://youtu.be/5pb2MZ5l7DY via  @YouTube,1
"desculpa lula molusco, tava raspando os pelos da minha jeba... viu ?? ",1
Exatamente  @LulaOficial,0
"A primeira característica de um bom governante é amar seu país e amar seu povo. Não se governa com ódio. Boa noite, se cuidem e até amanhã.",0
"Em 2018, apenas Ciro gomes venceria Bolsonaro no segundo turno. (https://veja.abril.com.br/politica/no-2o-turno-bolsonaro-so-perde-para-ciro-e-alcanca-haddad-diz-ibope/…) Alguem quer apostar em quem o cidadao abaixo votou no primeiro turno?",2
"Parem de bobagem. Se Ciro conseguir o milagre de duplicar os seus votos... Passando de 9(!) para 18%, quem vai para o segundo turno? Bolsonaro. E se Ciro TRIPLICASSE seus votos? Passado de 9 para 27! Quem iria para o segundo turno? Bolsonaro.  Não sejam linha auxiliar do fascismo",2
FALOU TUDO QUE PENSO twitter.com/keldavidd/stat…,0
Chupa aí  @simonetebetbr  !!!,0
"Mulheres de todas as idades prestigiam o presidente @jairbolsonaro em Novo Hamburgo (RS). VAI SER NO 1º TURNO, com a bênção de Deus! #Bolsonaro22",0
Vc já viu  @simonetebetbr  ?,0
Dra Nise Yamaguchi solta o verbo e desmente Simone Tebet; VEJA VÍDEO,0
"Simone Tebet, responda-me, você sente muita dor? ou já se acostumou com a dor que a b_rr_c_ crônica causa!!",0
"Bem vindo ao mundo da política! E também não se esquecendo da lei do retorno, quando o Bolsonaro falava que estavam fazendo covardia com os cidadãos de bem na pandemia e vc nada fez.",0
"Será que consigo 100 RT,s #SigaFirmeMoro",0
"#SigaFirmeMoro. NEGUE seu apoio ao Bolsonaro sem ""fazer de conta"", só precisa FAZER A COISA CERTA SEMPRE",0
"O Brasil inteiro está indignado. A retaliação do PT e do sistema da velha política foi sentida pela minha filha, hoje de manhã em Curitiba. Está clara a preocupação com o fraco desempenho do Lula e seus aliados. A corrupção é a pauta da eleição. O santinho do Moro, não.",1
"Tô no salão fazendo unha. O assunto é política/eleições. É, gente, olhar só pra nossa bolha tá perigoso demais. O trem tá feio. Essa eleição não será fácil.",0
"minha previsão pra essas eleições é Lula e Bobonaro no segundo turno, e o Bozo levando no segundo. Tomara que eu esteja errado ",1
"E pra celebrar o Rock in Rio, aqui vai um registro que reflete bem a minha esperança de que, muito em breve, NENHUM DE NÓS tenha que conviver com essa LEGIÃO de gados!    ",0
"O tema Deus, pátria e família é atrasado e marginaliza as pessoas que não se incluem nesse padrão,o governante de um país tem que saber governar para todos ,por isso aqui é Lula 13 no primeiro turno.",1
"Como é bom ver o jornalismo sério refrescando a memória do Ciro Gomes e expondo sua incoerência, oportunismo e rancor",2
"Em 2018, apenas Ciro gomes venceria Bolsonaro no segundo turno. (https://veja.abril.com.br/politica/no-2o-turno-bolsonaro-so-perde-para-ciro-e-alcanca-haddad-diz-ibope/…) Alguem quer apostar em quem o cidadao abaixo votou no primeiro turno?",2
"Parem de bobagem. Se Ciro conseguir o milagre de duplicar os seus votos... Passando de 9(!) para 18%, quem vai para o segundo turno? Bolsonaro. E se Ciro TRIPLICASSE seus votos? Passado de 9 para 27! Quem iria para o segundo turno? Bolsonaro.  Não sejam linha auxiliar do fascismo",2
Chupa aí  @simonetebetbr  !!!,0
"Mulheres de todas as idades prestigiam o presidente @jairbolsonaro em Novo Hamburgo (RS). VAI SER NO 1º TURNO, com a bênção de Deus! #Bolsonaro22",0
Vc já viu  @simonetebetbr  ?,0
Dra Nise Yamaguchi solta o verbo e desmente Simone Tebet; VEJA VÍDEO,0
"Simone Tebet, responda-me, você sente muita dor? ou já se acostumou com a dor que a b_rr_c_ crônica causa!!",0
"Uma vez eu fui no perfil do Flávio Bolsonaro zoar com ele e ele me respondeu me chamado de pirralha e me bloqueou kkkk eu ri tanto,porque a 'pirralha' aqui tem 30 anos kkkkkkk",0
Modalmais/AP Exata: Bolsonaro tem melhor proveito ‘pós-debate’ -,0
"""Gasto de Bolsonaro com TV já supera toda a despesa eleitoral de 2018"" via  @Metropoles",0
"Isso é muito grave!!!! Então Lula se irrita porque ninguém ""acabou"" com Palloci quando ""devia""?! Mas se isso não é conspiração para assassinato o que mais seria? Que outros crimes esse sujeito cometeu no poder? Sinistro!",1
"Hoje, o PT mostrou a “democracia” que pretende instaurar no país, promovendo uma diligência abusiva em minha residência e sensacionalismo na divulgação da matéria. O crime? Imprimir santinhos com letras dos nomes dos suplentes supostamente menores do que o devido. ",0
Não se esqueça que sua mulher assinou a cartinha do Lula,1
"... #Eleições2022 , a mais cara da #História .  @cirogomes  9 milhões de votos  @simonetebetbr  5 milhões de votos Para quê gastar dinheiro com o segundo turno .",0
"Como é bom ver o jornalismo sério refrescando a memória do Ciro Gomes e expondo sua incoerência, oportunismo e rancor",2
A mulher mais linda no Brasil @Janja @lualckmin_   @simonetebetbr,0
Chupa  @simonetebetbr  !,0
"Gente não publiquem esse vídeo, a Tebet não quer e o TSE proibiu a veiculação dele na TV e redes sociais.",0
"... #Eleições2022 , a mais cara da #História .  @cirogomes  9 milhões de votos  @simonetebetbr  5 milhões de votos Para quê gastar dinheiro com o segundo turno .",0
Ninguém: artistas mamadores da Rouanet. Aguenta mais: teta secou. Esse governo: Presidente Jair Bolsonaro.,0
"Rock in Rio: 'Ninguém aguenta mais esse governo', diz Renato Goes sobre Bolsonaro https://f5.folha.uol.com.br/celebridades/2022/09/ninguem-aguenta-mais-esse-governo-diz-renato-goes-sobre-bolsonaro.shtml?utm_source=twitter&utm_medium=social&utm_campaign=twfolha…",0
Vamos retweetar o pedido do PR Bolsonaro,0
"Vão mais um pouquinho,  @policiafederalr  irão se deliciar com o que vão encontrar. Deixando-os ou não.Pois autonomia é de vocês. E não tenho a menor sombra de dúvida que vocês sabem bem o que Moro fez contra  @LulaOficial  o povo deste país, e nossas leis.  @DelegadoSaraiva  !!!",0
"O PIOR ANALFABETO É O ANALFABETO POLÍTICO; É DELE  QUE NASCE A CORRUPÇÃO E CONSEGUINTE A PROSTITUIÇÃO, MISÉRIA ,VIOLÊNCIA, DOENÇAS E MORTES.  FILHOTES DO PT , PSDB,  MDB , PSOL E TODA PROLE LULA , DILMA  , FHC , ALKMIN; AFINAL FORAM MAIS  DE ANOS ROUBADO",1
"... #Eleições2022 , a mais cara da #História .  @cirogomes  9 milhões de votos  @simonetebetbr  5 milhões de votos Para quê gastar dinheiro com o segundo turno .",0
"Como é bom ver o jornalismo sério refrescando a memória do Ciro Gomes e expondo sua incoerência, oportunismo e rancor",2
A mulher mais linda no Brasil @Janja @lualckmin_   @simonetebetbr,0
Chupa  @simonetebetbr  !,0
"Gente não publiquem esse vídeo, a Tebet não quer e o TSE proibiu a veiculação dele na TV e redes sociais.",0
"... #Eleições2022 , a mais cara da #História .  @cirogomes  9 milhões de votos  @simonetebetbr  5 milhões de votos Para quê gastar dinheiro com o segundo turno .",0
"Bolsonaristas não conseguem mais defender ""honestidade"" de Bolsonaro após a descoberta de 51 imóveis comprados com dinheiro vivo",0
"Agradecemos as perseguições, mostram claramente o totalitarismo que a escumalha quer…e arrebanham mais votos para Bolsonaro! Votem no 22 Bolsonaro e no PL  22……",0
"Assista a ""É URGENTE ! BOLSONARO CHAMA XANDÃO DE VAGABUNDO !"" no YouTube",0
"Lula tem o consórcio de Imprensa, Presidente do Senador, TSE e $TF a seu favor. Bolsoanaro tem o Povo e Deus acima de Tudo. Bom dia",1
Michelle Bolsonaro compartilha vídeo que mostra Lula em ritual de religião de matriz africana e diz: 'Entregou a alma para vencer essa eleição' | Sonar - A Escuta das Redes | O Globo,0
E assim vamos  @cirogomes   @DepLoureiro   @PompeodeMattos   Vieira,0
"... #Eleições2022 , a mais cara da #História .  @cirogomes  9 milhões de votos  @simonetebetbr  5 milhões de votos Para quê gastar dinheiro com o segundo turno .",0
"Como é bom ver o jornalismo sério refrescando a memória do Ciro Gomes e expondo sua incoerência, oportunismo e rancor",2
A mulher mais linda no Brasil @Janja @lualckmin_   @simonetebetbr,0
Chupa  @simonetebetbr  !,0
"Gente não publiquem esse vídeo, a Tebet não quer e o TSE proibiu a veiculação dele na TV e redes sociais.",0
"... #Eleições2022 , a mais cara da #História .  @cirogomes  9 milhões de votos  @simonetebetbr  5 milhões de votos Para quê gastar dinheiro com o segundo turno .",0
"Please help support Bolsonaro Capitão do Povo 22, add a #Twibbon now!",0
Falando sobre a Lei Maria da Penha  @jairbolsonaro  disse: você prefere sacar a lei Maria da Penha ou uma arma? Respondi no  @o_antagonista,0
"QQ pessoa sã quer que o Estado a defenda. QQ governo competente, ao menos, promete q defenderá as pessoas. O governo insano e incompetente quer terceirizar a segurança dizendo as mulheres (a todos): se virem que o Estado é incapaz de proteger você.   Que desastre esse Bolsonaro.",0
Moro apoiando Bolsonaro é como o ciclista na foto abaixo:,0
"Como alguem consegue votar no lula nunca fez nada pelo povô brasileiro, se tivesse feito a metade do que fez por outros países o Brasil seria uma potência.",1
Não esquecemos Lula quer voltar ao local do crime disse seu próprio vice.,1
Estou boba de como o velho Lula conhece o sistema!! Profético!! ,1
Sou fã das voltas que o mundo dá. GRANDE DIA,0
"Como é bom ver o jornalismo sério refrescando a memória do Ciro Gomes e expondo sua incoerência, oportunismo e rancor",2
"... #Eleições2022 , a mais cara da #História .  @cirogomes  9 milhões de votos  @simonetebetbr  5 milhões de votos Para quê gastar dinheiro com o segundo turno .",0
E assim vamos  @cirogomes   @DepLoureiro   @PompeodeMattos   Vieira,0
A mulher mais linda no Brasil @Janja @lualckmin_   @simonetebetbr,0
Chupa  @simonetebetbr  !,0
"Gente não publiquem esse vídeo, a Tebet não quer e o TSE proibiu a veiculação dele na TV e redes sociais.",0
"... #Eleições2022 , a mais cara da #História .  @cirogomes  9 milhões de votos  @simonetebetbr  5 milhões de votos Para quê gastar dinheiro com o segundo turno .",0
"Acho interessante o pessoal que quer Bolsonaro fora, mas quer o L de volta a cena do crime.  Que vota na 3a via, mas que esta fará apoio ao L no 2° turno.  Se Deus quiser confirmaremos nas urnas o que vemos nas ruas e redes sociais.  #BolsonaroReeleitoEm2022",0
Eh mas oh os eleitores de Bolsonaro já sabem que eh o Thorcisio e mais não mas eh novo governador de SP e Bolsonaro22 até 26...a  @CNNBrasil  fechará e vc tentará viver de um blog..forte abraço petezada Bolsonaro22 até 26.,0
"SABE aquele pessoal que não tinha BANDIDO de ESTIMAÇÃO! ADOTARAM uma FAMÍLIA inteira de LADRÕES MILICIANOS  Seguiu, sigo de volta  Meta, Eleger  Paulo Teixeira 1398 Lula dia 02 de Outubro e BOLSONARO PRESO em 2023",1
"#BolsonaroReeleitoEm2022 @tarcisiogdf  segue firme mostrando as verdades que a imprensa se nega a ver.  Bolsonaro é SENSÍVEL sim !! Manda no zap das tias , vai ser sucesso!!",0
Mensagem do Nelipe Neto pra você  @LulaOficial  toma vagabundo #BolsonaroReeleitoEm2022,0
"O PIOR ANALFABETO É O ANALFABETO POLÍTICO; É DELE  QUE NASCE A CORRUPÇÃO E CONSEGUINTE A PROSTITUIÇÃO, MISÉRIA ,VIOLÊNCIA, DOENÇAS E MORTES.  FILHOTES DO PT , PSDB,  MDB , PSOL E TODA PROLE LULA , DILMA  , FHC , ALKMIN; AFINAL FORAM MAIS  DE ANOS ROUBADO",1
Bom dia. Faltam 5 domingos pra que possamos eleger  @LulaOficial  no 1 turno. Ótimo domingo!,0
E assim vamos  @cirogomes   @DepLoureiro   @PompeodeMattos   Vieira,0
"... #Eleições2022 , a mais cara da #História .  @cirogomes  9 milhões de votos  @simonetebetbr  5 milhões de votos Para quê gastar dinheiro com o segundo turno .",0
"Como é bom ver o jornalismo sério refrescando a memória do Ciro Gomes e expondo sua incoerência, oportunismo e rancor",2
Bom dia  @simonetebet  vamos de Michelle?,0
Mais um vídeo da Michelle. Vamos compartilhar antes que a Simone Estepe mande tirar do ar.,0
A mulher mais linda no Brasil @Janja @lualckmin_   @simonetebetbr,0
Chupa  @simonetebetbr  !,0
