tweet,rotulo
"Juiz LADRÃO,legislou em causa própria, a raiva da eleite brasileira como você,é ver um trabalhador vindo do Nordeste num pau de arrara,  operário,e sem o curso superior chega ao centro do poder,e vocês não,  por isso nós brasileiros devolveremos ao lula a presidencia do Brasil.",1
"Lula comprou 51 imóveis com dinheiro vivo, prendam ele já  @SF_Moro",1
"Pelo Twitter, Moro ataca Lula, diz que petista foi responsável por ""esquema de corrupção de bilhões na Petrobras"", mesmo sem ex-presidente ter sido considerado culpado e reclama de ação da Justiça Eleitoral contra ele. ""O PT não me intimidará, nunca conseguiu"", escreveu o ex-juiz",0
Desintoxica  Chega desse populismo eleitoral Coloca Lula para debater com Ciro Gomes É disso que o Brasil precisa,2
Bem-vinda ao Brasil da esperança  Cactos do mundo uni-vos ,0
⁦ @cirogomes ⁩ sem perder a esperança jamais.,0
"Pra ser bem popular, Ciro Gomes é aquele candidato que nada, nada, nada e perece na praia, com no máximo 12%.",2
"TERCEIRA VIA NO SENADO   • Simone Tebet (MDB) votou com o inominável 85% das vezes. • Soraya Thronicke (União Brasil), 89%.  Fonte: Congresso em Foco.",0
"Aprendam (steps)  @simonetebetbr  e  @JanjaLula  Contra a Verdade, Pureza de Alma e Patriotismo não há lei! Você viralizaram o vídeo que não queriam que fosse publicado",0
"Só pra deixar registrado, quem pretende votar no Ciro ou na Simone Tebet Nn estar raciocinando q automaticamente estar colocando o Bolsonaro no 2° turno, pensem nisso gente, Lula é o voto útil pra derrotar esse miliciano ainda no 1° turno, é 13! #LulaNo1ºTurno #LulaPresidente13",0
Ainda tem gente que acha que esse ladrão é salvador da pátria...  Temos o dever de reeleger  @jairbolsonaro  no primeiro turno e sumir com esse verme daqui.,0
Jornalista Mexicana está entrevistando o ex-presidiário e fica assustada e abismada com a resposta do sujeito. Essa excrescência morre pela boca! Vamos divulgar em massa!,0
"Pesquisa nacional traz Bolsonaro com 40,1% contra 36,9% de Lula",1
Apenas o fato de poder ser em partes a realidade das nossas forças armadas é decepcionante. Deus queira que não seja msm assim.  @exercitooficial  @marmilbr  @fab_oficial  @jairbolsonaro,0
"Nunca vou perdoar as FFAA por ter que compartilhar esse lixo do porta dos fundos, ficou excelente e retrata perfeitamente a realidade.... PQP..... kkkkkkkkkkkkkkkkkkkkkkkkkkkkkkkkkkkkkkkkkkkkkkkkkkkkkkkkkkkkkkkkkkkkkkkkkkkkkkkkkkkkkkkkkkkkkkkkkkkkkkkkkkkkkkk twitter.com/portadosfundos…",0
O Brasil reconhece lula como velho caducando e bebum não tem como governar o Brasil .,1
"Pesquisa nacional traz Bolsonaro com 40,1% contra 36,9% de Lula",1
"Padre no final da missa aqui, tridentina, falando também do plano de tomada da América Latina pelos comunistas e que é pecado mortal votar neles e em outras porcarias marxistas . Naturalmente isso inclui também o Ciro Gomes, mas ele não citou nomes.",2
"Creio que será difícil, além de desagradável pra você ⁦ @cirogomes ⁩ está cena. É melhor que o inescrupuloso saia pela ⁦ @portadosfundos ⁩ ⁦ @FEsculhambado ⁩",0
"A prova de que  @cirogomes  faz campanha para o fascismo e contra  @LulaOficial  . Quem defende Ciro, portanto, advoga em favor dos mais de 684 mil brasileiros mortos pela omissão do Estado. Quem defende Ciro é contra a política de cotas.",2
Ciro fala pra militante do mula livre,2
"E vamos nós  de novo com a belíssima primeira Dama mandando um recado ,pena que sofreu um boicote de outra mulher  @simonetebetbr  ,infelizmente esta senhora pede votos para as mulheres e pede o silêncio de outra mulher. Bom dia sem hipocrisia",0
Michelle Bolsonaro retruca e dá lição de moral para Simone Tebet sobre l... https://youtu.be/5fP-0ZGbAS8 via  @YouTube,0
"TERCEIRA VIA NO SENADO   • Simone Tebet (MDB) votou com o inominável 85% das vezes. • Soraya Thronicke (União Brasil), 89%.  Fonte: Congresso em Foco.",0
PL e marqueteiros da campanha de Bolsonaro escantearam o filho Carluxo - Brasil 247,0
Eu comecei a passar protetor solar todo dia no rosto e no pescoço quando eu vi uma foto de perto do rosto do Bolsonaro e fiquei horrorizada,0
Apenas pensando nele... no pescoço da mulher que não passou protetor solar e automaticamente desesperada com meu pescoço que nunca recebeu uma gota de protetor,0
"Eu realmente não duvido que muito centrista que pensava em anular ou votar em um terceiro candidato, agora vai dar um voto útil pro Bolsonaro depois do que aconteceu na casa do Moro.",0
Voto nulo é igual VOTO EM LULA!,1
Lula espera levar chance de vencer no 1º turno até o debate da Globo,1
Lula que acabar com o AGRO mas gosta de cachaça e picanha. Como pode ser tão burro assim?,1
Presidente:  @cirogomes  12 Governador:  @robertoclaudio  12 Senador:  @erikaamorimce  555 Dep Federal:  @andrepdt12  1234 Dep Estadual: Dr Hugo 55678  O trabalhismo cresce ,0
"07/09 vai ser um tiro no pé para Bolsonaro! Os indecisos q prezam pelo Estado Democrático, q por ventura estavam pensando em votar nele, mudarão seus votos para outros candidatos q tb se opõe ao PT Seguindo essa lógica  @cirogomes  é o q mais se contrapõe ao Lula. #CiroPresidente12",1
A votação é essa! @ZacconeOrlando   @delmartharocha   @CaboDaciolo   @_RodrigoNeves_   @cirogomes,0
Aí meninas essa é a nossa escolha  @simonetebetbr  e  @SorayaThronicke,0
Por que a Simone estepe não deixa a Michelle Bolsonaro será que ela não respeita mulher a Simone estepe,0
É  @simonetebetbr  deu ruim pra vc! As mulheres vão ter q escolher entre quem lhes dá voz e quem tenta calá-las!,0
O pessoal sempre fala do artista e do Bolsonaro q gosta de trocar esposa por Mlhr mais nova mas e o ciro gomes ? Namorando uma mulher com idade pra ser neta dele kkkkk,2
"Vejam o #ódio dessa mulher. Esses são os defensores do Bolsonaro, vcs acham que eles respeitam a #Democracia ? #ForaBolsonaro #STF #OAB #racismo #Bolsonaro #Portugal",0
O Governo Bolsonaro envergonha o Brasil #LulaNoPrimeiroTurno #BolsonaroNuncaMais #BolsonaroMetaversoDaCorrupcao #Lula #Bahia #Forabolsonaro #GuedesFalastrao,1
"Ciro falando a verdade, agora só conta mentiras e vai ladeira abaixo. Inveja de Lula, você nunca será presidente,  @cirogomes",1
#FORA BOLSONARO! LULA PRESIDENTE 13,1
COPIE E COLE. BOM DOMINGO  ESQUERDAPT VAMOS ZOAR NA TWITTELANDIA. ATÉ LULA CHEGAR NO PLANALTO E SE INSTALAR. % ME SEGUE E EU TE SIGO #LulaEoPT13deFioApavio #Lula13EdegarPretto13 #LulaEoPTjaNo1ºTurno @LulaOficial,1
"Minha priminha de 15 anos discutindo política com os pais bolsonaristas, dizendo que se pudesse votar seria no Ciro Gomes.   A base vem forte ",2
"Ciro falando a verdade, agora só conta mentiras e vai ladeira abaixo. Inveja de Lula, você nunca será presidente,  @cirogomes",1
O pessoal sempre fala do artista e do Bolsonaro q gosta de trocar esposa por Mlhr mais nova mas e o ciro gomes ? Namorando uma mulher com idade pra ser neta dele kkkkk,2
"Bom dia meu povo! Só pra constar aqui, eu sou mulher e vou votar no presidente Jair Messias Bolsonaro tá. Que nossa senhoa  @simonetebetbr  fique sabendo disso. Mulher vota em quem ela quiser, ela é livre e mora em um país livre! #BolsonaroReeleitoEm2022 ",0
QUEM É SIMONE TEBET? | Cortes do História Pública https://youtu.be/ydNOJ1ifdEI via  @YouTube,0
"Vão chamar a Simone Tebet no lançamento pra cortar umas árvores, fazer umas queimadas e plantar soja em terra indígena. Mas que ideia de merda!",0
O Cuiabá divulgou hoje o seu novo terceiro uniforme em homenagem ao agronegócio. Usaria?   Divulgação/Cuiabá,0
"Por isso é 22 Bolsonaro Parabéns Paulo Guedes, o melhor ministro da economia do Brasil",0
"PIB Brasil  Anual +3,2% Trimestral +1,2%",0
"E aí  @JanjaLula  vc pediu para compartilhar a verdade, está aí a primeira parte da verdadeira história da Transposição que foi entregue pelo nosso Presidente Jair Messias Bolsonaro!!parem vocês de mentire enganar o povo em nome do poder!!",0
Jhanjha pediu pra compartilharmos a verdade..  então tá aí jhanjha,0
"Lula e Bolsonaro significa permanência do ódio, permissividade a corrupção. Nada de voto útil, por isso existe 2o turno.   Vou de Ciro!",1
"O crescimento de Ciro, em termos absolutos no DataFolha, contém outras novidades ainda mais positivas nos cortes por segmentos. Isso é suficiente para garantir avanços bem significativos no curto prazo. ",2
Documentário 580 dias da prisão de Lula  é espetacular e emocionante.  Parabéns ao jornalista  @joaquimmonstrao  e ao  @brasil247   por essa obra.,1
COVARDIA EXPLICITA?? PARA MIM É OPORTUNISMO E MANIPULAÇÃO!!! Análise e decida!! Se arrependimento matasse? Lula muda fala e diz que homem tem que repartir tarefas com mulher - Clique para ver também ☛  https://terrabrasilnoticias.com/2022/09/se-arrependimento-matasse-lula-muda-fala-e-diz-que-homem-tem-que-repartir-tarefas-com-mulher/… via  @TerraBrasilnot,1
Vídeo – Felipe Neto: “Por que vou votar no Lula?”  https://apostagem.com.br/2022/09/03/video-felipe-neto-por-que-vou-votar-no-lula/…  *** *Siga-nos* *** *Telegram:* https://t.me/apostagem  *Whatsapp:* https://chat.whatsapp.com/GFsPsR0Tv4M2TGXDeki04y…,1
Minha cola no RJ Presidente @cirogomes  12 Senadores @CaboDaciolo  121 @raulbittencourt  800 Governador @_RodrigoNeves_  12 Dep. Federal @southaferreira  5510 Dep. Estadual @gioalmeida_UP  ? Ainda estou indecisa aqui... Sei que quero mulher para aumentar a nossa representação política!,0
Minha colinha no RS  Presidente:  @cirogomes 12  Governador:  @VieiraPDT 12 Senador: Pesquisando Dep. Federal:  @JulianaBrizola 1234 Dep. Estadual:  @EngZini 12120,0
Cumé qui é ? Cid Gomes irmão de Ciro Gomes vai votar em Camilo Santana candidato do PT ao Senado ? Então ele vai votar no Lula ? Eita q a coisa tá esquentando. Tá bom dimais da conta sô . Tudo se rachando e Bolsonaro se consolidando . #BolsonaroNoPrimeiroTurno,2
Será que me confundiram com o Ciro Gomes?,2
"E ai Simone Stép, como fica. Primeira-dama evitou citar nomes, mas fez referência a uma ação interpelada por Simone Tebet",0
Ei! @JanjaLula  @simonetebetbr   está sim é um exemplo de nobreza! Chorem de inveja!!!,0
"Bela definição Se você é contra esse governo, vote para encerra-lo, vote 13, Vote Lula. #LulaEoPT13deFioApavio  Hildegard Angel: 'Simone Tebet é uma pedalada jornalística da Globo'",0
Vamos rir um pouco   @jairbolsonaro  @BolsonaroSP  @FlavioBolsonaro  @CarlosBolsonaro  @programapanico,0
"Uma é Lula e a outra é bolsonaro, e mesmo assim temos 15 anos de amizade",1
"Em qual capítulo estamos da série "" Bolsonaro tinha razão ?",0
Bom dia.,0
Lula é um chefe de quadrilha condenado. Ex-presidiário. Nunca foi inocentado.  Fatos são fatos.,1
Ué! Por que Lula nunca colocou a dona Marisa para fazer propaganda?,1
"As mulheres são maioria e merecem um governo que as trate com respeito. Mensagem da @JanjaLula no programa de TV exibido ontem. Vamos, juntas e juntos, melhorar a vida no Brasil. Bom domingo pra nós.",0
"Copie e cole. Vou votar em Lula! Sou Lula! Quem  for votar no Lula, me segue que eu sigo de volta! Esquerda segue Esquerda!  @Nilsonhandebol @RgisRosa11",1
"CIRO é a única mudança para o Brasil. Os outros dois são a continuação da corrupção e da crise profunda. É CIRO GOMES PRESIDENTE, É 12. #CiroCresce #CiroPresidente12",2
"Nunca fiz campanha pra ninguém. Anulava meu voto. Nunca fui acusado por um direitista de ""eleger o PT"" quando o PT vencia. Aí, desde 2018, quando decido por fazer campanha pelo projeto do Ciro Gomes, lulistas me enchem o saco.",0
"Você pode seguir quem vc quiser nas mídias sociais, só não pode vender a sua dignidade, o seu caráter e o seu voto. Tenha personalidade e decida a favor do Brasil. Ciro Gomes. O melhor dos candidatos!",2
"Ciro Gomes é um  hipocondríaco político,como não tem votos pra se eleger presidente,reclama do PT e do Luiz Inácio incessantemente,parece uma sanfona véia do fole furado,sua retórica mais parece um arrastar de correntes,incoerente,inconsequente e mente descaradamente.",2
"Petistas petulantes, vocês terão uma grande surpresa. O povo está vendo quem é o mais honesto e tem programa. Ciro Gomes será o próximo Presidente do Brasil ",2
"Aiiii gente, o Petê não não nem a capacidade de ser original. Não é que colocaram a Canja na propaganda eleitoral do Descondenado?! QUIIIIIRIDA quem nasceu Canja de Descondenado, JAMAIS SERÁ MICHELLE.  E aí dona Tablet  @simonetebetbr  vai ficar calada?!",0
"Jornalistas e a “feminista” que diz que mulher tem q estar aonde quiser estar , @simonetebetbr  !",0
"Mais um vídeo de Michelle Bolsonaro, esposa do presidente Bolsonaro! Um vídeo que deixa os jornalistas morrendo de ódio! #BolsonaroReeleitoEm2022",0
Sangue novo ou mais do mesmo? Simone Tebet é ligada ao agro e contrária a direitos indígenas,0
Aquias Santarem: “Bolsonaro paga de crente para enganar muita gente”,0
me perguntando como é que o w13 ta segurando o carro do bolsonaro holandes até agora,0
"Bolsonaro e misógino, quer dizer tem ataque histérico ao ver uma mulher brilhar",0
Diário do Centro do Mundo: Ex-presidente do Ibope diz que eleição está decidida; Lula lidera em todos os cenários.,1
"GOVERNA PARA TODOS! VOLTA LULA, PARA TIRAR O DEMÔNIO DO BOLSONARO!",1
Lula e collor a União de tudo q n presta,1
"Ciro Gomes entrando na lata de lixo da história, Bolsonaro é o próximo...",2
Não da pra crítica o Bozo e achar que a solução é o Barba. Por isso vou  @cirogomes  ,0
Kkkkkkkkkkkkkkkkkkk a papada  do Ciro Gomes parece um morcego frutífero comendo uvas verdes de ponta cabeça  um luxo,2
"Obrigada, dermatologista que fez a análise da pele dos candidatos ",0
"O candidato à Presidência Ciro Gomes (PDT) esteve no município de Serra, no Espírito Santo, neste sábado (3), e acentuou as críticas ao ex-...... ",2
"Vamos divulgar os vídeos da 1a Dama, que foi proibida pelo TSE de fazer campanha, a pedido da presidenciável Simone Tebet..",0
FICIALMENTE DEFINIDO  Dep. Estadual -  @leticiaarsenio  19019 Dep. Federal - a definir Senador - a definir Governador -  @_RodrigoNeves_   Presidente -  @simonetebetbr    Meus votos serão preferencialmente em mulheres.,0
"Vamos divulgar os vídeos da 1a Dama, que foi proibida pelo TSE de fazer campanha, a pedido da presidenciável Simone Tebet..",0
Marqueteiros de Bolsonaro isolam Carluxo,0
O CASTlG0 CHEGOU! FIZERAM ISSO com BOLSONARO e MICHELLE e a RECOMPENSA A... https://youtu.be/nxdgxh4Oa3g via  @YouTube,0
#ANTOLÓGICO:BOMDIA!?Bolsonaro sofre ataque / Band e PGR detonam Moraes / TSE atende pedido d... https://youtu.be/AcxdSS5-Lvc via  @YouTube,0
"Não engulo essa história de voto útil. Vou votar no Lula, mas acho extremamente anti democrática essa história de dizer que votar em Ciro ou Tebet é votar no Bozo. Votar no Ciro ou em Tabet é votar em Ciro ou em Tabet. Exerçam seu direito democrático, votem em quem acreditam.",2
"Sejamos discretos sempre. Mesmo quando a vontade seja de gritar o que está dentro do coração.  Eu sou Lula, eu carrego o vermelho de forma discreta.  Aguardando ansiosa para votar 13!",1
"Sejamos discretos sempre.   Eu sou Lula, eu carrego o vermelho de forma discreta.  Aguardando ansiosa para votar 13!",1
#Haddad e #Alckmin estão no time que vai mudar São Paulo e vamos juntos por SP e pelo Brasil! haddad13 #lula13 #haddadgovernador13 #vote13 #alckmin ⁦ @Haddad_Fernando ⁩ ⁦ @geraldoalckmin ⁩ ⁦ @ptbrasil ⁩ ⁦ @LulaOficial ⁩,1
"O Presidente Lula, deveria junto ao Congresso aprovar a ""Lei antiganância"", para limitar os altos juros dos Bancos, pode ser com outro nome, já que esta é uma proposta do Ciro Gomes. E não somente fazer acordos com a Instituição Financeira para ajudar o povo.",2
Vocês sabiam que o  @cirogomes  já foi dançarino do Justin Bieber? Ninguém segura o homem  @gisellebezerra,0
"Olha o boZo encampando proposta do  @cirogomes  ! TODOS agora querendo copiar as propostas do Ciro! Votem no original que é melhor e mais fácil, gente… sem contar que se perguntar pra ele como fazer,de onde vem o $,etc, vai ficar com cara de bunda!",0
"Bolsonaro está tão desesperado que continua prometendo Auxílio Brasil de R$ 600, mesmo sem estar na sua proposta de orçamento. Agora ele inventou que vai taxar lucros e dividendos de quem ganha acima de R$ 400 mil por mês.  Ei @jairbolsonaro, É um crime ser rico no Brasil? ",0
Pra quem acha que  @simonetebetbr  e  @SorayaThronicke  são contra Bolsonaro:,0
"Simone Tebet (MDB) votou no Senado alinhada com o governo Bolsonaro em 85% das ocasiões. Soraya Thronicke (União Brasil), 89%. Dados do Congresso em Foco.",0
Vamos divulgar até fazer LER ( lesão de esforço repetitivo)  @Simonetebet  conseguiu efeito contrário além de obter o desprezo das mulheres !,0
"Sororidade de b*ceta é siririca!!! Se vc quer Bolsonaro no segundo turno, faça como a Simone Tebet.",0
Ora...ora... Bolsonaro tem razão ?!,0
"Neste perfil: fotos de bebê (não é mais bebê ), vida real, sci-fi, reclamações, games, fora bolsonaro, tecnologia, dicas de carreira e lula lá",1
Eu nunca vou perdoar o bolsonaro por me fazer concordar com o frota,0
"Simone Tebet (MDB) votou no Senado alinhada com o governo Bolsonaro em 85% das ocasiões. Soraya Thronicke (União Brasil), 89%. Incrível que agora ambas dizem que não concordam com nada, que farão diferente que as decisões serão outras,mas foram muito Governistas .",0
"Esse é o Jair Bolsonaro, Capitão do Povo. #JairBTemMeuVoto",0
Mais um desatino de Lula!,1
BOM DIA! Lula presidente.,1
E o PT? E o Lula?,1
"O Brasil inteiro está indignado. A retaliação do PT e do sistema da velha política foi sentida pela minha filha, hoje de manhã em Curitiba. Está clara a preocupação com o fraco desempenho do Lula e seus aliados. A corrupção é a pauta da eleição. O santinho do Moro, não.",1
Eleição sem Ciro Gomes não tem graça.,2
Nosso cabo eleitoral em ação...kkk,0
"Você sabia que o Comandante Robinson Farinazzo está filiado ao partido de Ciro Gomes, o PDT?  Esse Robinson do canal ""ARTE DA GUERRA"" é um melancia - Usando-se de meias verdades para potencializar velhas mentiras: Faz constantemente propaganda pró eixo russo-chinês.",2
Meu DEUS!!!Eu estou enganada ou este é CIRO  sério quê ele deixou ô ódio tomar conta do seu coração triste fim do    @cirogomes  mais ô Amor vencerá o ódio #VamosJuntosPeloBrasil Lula presidente no primeiro turno é LULA 13,1
Só o rancor de não ter sido apoiado em 2018 explica uma mudança de opinião tão violenta. twitter.com/Ceissa_Med/sta…,0
"Se ganharmos as eleições, quero convidar as quebradeiras de coco do Maranhão para uma grande reunião comigo em Brasília, para decidirmos o que precisa ser feito para vocês. Esse é o sentido da política, melhorar a vida das pessoas.",0
"Lula e Bolsonaro já tiveram meu voto útil Em suas eleições, e fizeram um péssimo governo, neste caso voto em Simone Tebet.  MJ.",0
"Vivemos tempos difíceis. Nem nas igrejas se tem paz. O lugar onde deveria haver amor e tolerância, o ódio fez mais uma vítima. Um homem foi baleado durante um culto em uma igreja evangélica por questões políticas. O Brasil precisa de paz!  https://metropoles.com/brasil/pm-atira-em-fiel-apos-discussao-politica-em-igreja-evangelica-de-goias…",0
Só falta agora a Simone Tebet aproveitar a ocasião e culpar o Bolsonaro! Oportunista!,0
"Simone Tebet (MDB) votou no Senado alinhada com o governo Bolsonaro em 85% das ocasiões. Soraya Thronicke (União Brasil), 89%. Dados do Congresso em Foco.",0
Simone Tebet (MDB) votou no Senado alinhada com o governo Bolsonaro em 85% das ocasiões;,0
"Esse é o Jair Bolsonaro, Capitão do Povo. #JairBTemMeuVoto",0
"Lula e Bolsonaro já tiveram meu voto útil Em suas eleições, e fizeram um péssimo governo, neste caso voto em Simone Tebet.  MJ.",0
"ELIANE CATANHÊDE: 'Alckmin não é  suficiente para o Sudeste nem Michelle para evangélicos, mulheres e pobres' (via @EstadaoPolitica) https://bit.ly/3RvRreq",0
Bolsonaro sempre teve RAZÃO,0
Bom dia.,0
Lula se fode .do fala merda...#BolsonaroNoPrimeiroTurno,1
Os políticos aq fazendo tudo campanha dizendo q são apoiados por Lula kkkkkk,1
Detectado o “choque” sofrido por Lula que prejudicou fatalmente o seu desempenho no debate da Band (veja o vídeo),1
"É na dificuldade que encontramos forças para lutar, estou com  @cirogomes  e  @AnaPaulaMatosBA  ",0
A última DataFolha começa a indicar o que estamos dizendo há tempos: Ciro é o candidato potencialmente mais forte para enfrentar Bolsonaro no 2º turno. Os sinais do enfraquecimento de Lula tornam-se cada vez mais evidentes. ,1
Brizola não estaria no PDT…  @cirogomes  seria uma vergonha pra ele. Não por acaso o partido está isolado.  @cirogomes  usa a política como meio de sobrevivência material. Fundos partidários,0
Triste fim do PDT: acabar como linha auxiliar do bolsonarismo na campanha.  Brizola não merecia isso.,0
#PNDBRASIL #CIROGOMES12  #COMPLEXOINDUSTRIALDADEFESA ALÔ  @cirogomes  VAMOS FALAR DA VARIG!!!,0
"Corre aqui,  @simonetebetbr  ! Aciona a justiça também.",0
"As mulheres são maioria e merecem um governo que as trate com respeito. Mensagem da @JanjaLula no programa de TV exibido ontem. Vamos, juntas e juntos, melhorar a vida no Brasil. Bom domingo pra nós.",0
"Lula e Bolsonaro já tiveram meu voto útil Em suas eleições, e fizeram um péssimo governo, neste caso voto em Simone Tebet.  MJ.",0
"ELIANE CATANHÊDE: 'Alckmin não é  suficiente para o Sudeste nem Michelle para evangélicos, mulheres e pobres' (via @EstadaoPolitica) https://bit.ly/3RvRreq",0
"Da o Brasil para o Bolsonaro comanda por mais 4 anos é loucura. Voto em  @cirogomes  E  @simonetebetbr   é dá a oportunidade do maldito ir ao 2 turno, ou seja voto inútil. TEMOS QUE VOTAR EM  @LulaOficial  NO 1 TURNO E CBAR DE VEZ COM AS MENTIRAS DE BOLSONARO.",0
bolsonaro fdp baixa o preço do kunk,0
"Justin Bieber, se tu não aparecer seus fãs vão começar uma revolução, tá sobrando até pro Jair Bolsonaro.",0
como sambam essas beliebers,0
"Esse é o Jair Bolsonaro, Capitão do Povo. #JairBTemMeuVoto",0
"Copie e cole. Vou votar em Lula! Sou Lula! Quem  for votar no Lula, me segue que eu sigo de volta! Esquerda segue Esquerda! JUNTOS PELO BRASIL.   @Nilsonhandebol",1
33 milhões de famintos LULA É A SOLUÇÃO JAIR JÁ ERA,1
DIA 2 DE OUTUBRO VAI SER COLOSSAL! VAMOS DAR UMA RESPOSTA NAS URNAS EM ALTO E BOM SOM A ESSE BOBO DA CORTE! CHEGA DE PALHAÇADA! O VAGABUNDO NÃO TRABALHOU PRO PAÍS DURANTE ESSES 3 ANOS E 9 MESES! O PAÍS PRECISA DE UM PRESIDENTE DE VERDADE! VOTE LULA 13!,0
"Hoje tô só o Ciro Gomes, sou Ceará desde criancinha",2
Conclamo os meus irmãos e irmãs do Brasil a votarmos nas IDEIAS de Ciro Gomes!,2
"Arrasou na pergunta. Ciro não soube responder pq né, a fala anterior dele já disse tudo. Sem contar que um apoiador/segurança sei lá, não deixou o morador terminar de filmar, Ciro não disse nada, não deu explicações. Ciro Gomes jamais será presidente do Brasil.",2
"""IMAGINE EXPLICAR ISSO NA FAVELA?"" Ciro Gomes (PDT) participou de uma live no Aglomerado da Serra, em BH, na noite deste sábado. No fim do evento, um morador questionou o candidato sobre uma polêmica declaração a respeito das favelas  https://em.com.br/app/noticia/politica/2022/09/03/interna_politica,1391123/morador-do-aglomerado-da-serra-discute-com-ciro-apos-fala-sobre-favelas.shtml?utm_source=hardnews&utm_medium=hardnews&utm_campaign=score&utm_term=undefined…",2
Ciro Gomes | Janones não defende favela e não pode criticar ninguém. É apenas um oportunista! https://youtu.be/kwQf4SuStk4 via  @YouTube,2
"Vai tirar esse tbem  @simonetebetbr  ?  ""Tente outra vez"" pois mulher de verdade, sem vitimismo, não cai na sua de proteção as mulheres, meu voto você nunca terá.",0
"Esse é o Jair Bolsonaro, Capitão do Povo. #JairBTemMeuVoto",0
E agora  @simonetebetbr  @OmarAzizSenador  @renancalheiros  @EduardoBraga_AM  o JB e foda mesmo kkkk ele é o capitão do povo que vai vencer de novo!,0
Bom dia.,0
E aí  @simonetebetbr   PEGA NA MENTIRA !!,0
"Ela deve ter saudades daquele tempo, em que as mídias eram somente no papel e se podia negociar com a imprensa o que poderiam publicar…  Agora as provas são irrefutáveis",0
"Sem agenda de campanha, Bolsonaro vai à troca da bandeira, em Brasília https://otempo.com.br/eleicoes/sem-agenda-de-campanha-bolsonaro-vai-a-troca-da-bandeira-em-brasilia-1.2727553…",0
"O Presidente Bolsonaro não só está transformado o Brasil numa nova Nação, como está mudando o conceito e os valores do mundo em relação ao Brasil.",0
"vai falar agora que só o lula é ex presidiário? kkkkkkkkkkk, que no caso, foi preso só pra bolsonaro poder entrar",1
"Eu até iria votar no Lula mas agora faço questão de ir de Ciro, quero ver o segundo turno pegando fogo, esquerda burra que ataca aliado a toa não merece um voto sequer",1
"Pronto, os ""cactos"" me encontraram e agora vão infernizar a minha vida porque eu acho que sim, celebridades deveriam evitar fazer propaganda de animais de raça (propaganda paga ou não).  twitter.com/Dy01J/status/1…",0
https://youtu.be/r8mvnxcDi6c Grande documentário que mostra nossa luta é nossa vitória junto com Presidente Lula.,1
"vai falar agora que só o lula é ex presidiário? kkkkkkkkkkk, que no caso, foi preso só pra bolsonaro poder entrar",1
No fundo é medo do Ciro Gomes estar no 2° turno,2
Kkķkkkķ AGORA É CIRO GOMES!,2
Cada vez tenho mais certeza..Eu vou de  @cirogomes  .Eu amo meu Brasil e quero o melhor pra ele e neste momento Ciro é o mais preparado e com propostas concretas e  mais é ficha limpa!  @cirogomes   #CiroPresidente12 #Ciro12 #CiroCresce,2
